text,author,reply,retweet,like,date,cleaned_text
"Jadi Pemilu 2024 itu dinilai Prof Jimly (Yang bisa dipercaya) ini adalah Pemilu paling Jurdil dan transfaran, begitu?",Hendi Permana,0,0,0,2024-03-06T03:08:08.000Z,"Jadi Pemilu 2024 itu dinilai Prof Jimly (Yang bisa dipercaya) ini adalah Pemilu paling Jurdil dan transfaran, begitu?"
"Pastikan Kota Sibolga Aman, Polres Sibolga Laksanakan Patroli Dialogis Di Kantor Penyelenggara Pemilu 2024.",Humas Polres Sibolga,0,0,0,2024-03-06T03:07:36.000Z,"Pastikan Kota Sibolga Aman, Polres Sibolga Laksanakan Patroli Dialogis Di Kantor Penyelenggara Pemilu 2024."
Lebih percaya pemilu 2024 jurdil gw sih,Beda.Genre,0,0,0,2024-03-06T03:10:31.000Z,Lebih percaya pemilu 2024 jurdil gw sih
"HAK ANGKET HARUS DILAKSANAKAN UNTUK MEMBUKA TABIR KECURANGAN PEMILU 2024...

PKS KLAIM SUDAH ADA 5 PARTAI YANG MENDUKUNG DI GULIRKANNYA HAK ANGKET, TERMASUK NASDEM DAN PPP....

#Pemilu2024MilikRakyatRI 
#Pemilu2024MilikRakyatRI 
",JATAYUBACK,1,3,3,2024-03-06T03:19:10.000Z,"HAK ANGKET HARUS DILAKSANAKAN UNTUK MEMBUKA TABIR KECURANGAN PEMILU 2024...  PKS KLAIM SUDAH ADA 5 PARTAI YANG MENDUKUNG DI GULIRKANNYA HAK ANGKET, TERMASUK NASDEM DAN PPP....        "
"Keberhasilan partai politik dalam pemilu bergantung pada kepiawaian Ketua menerapkan strategi. Kesuksesan tersebut tampak pada diraihnya Kursi Partai Golkar di Jawa Timur mulai level DPRD kabupaten/kota, DPRD provinsi, dan DPR RI di Pemilu 2024 ini.

Anies",surabayapagi.id,0,0,0,2024-03-06T03:01:20.000Z,"Keberhasilan partai politik dalam pemilu bergantung pada kepiawaian Ketua menerapkan strategi. Kesuksesan tersebut tampak pada diraihnya Kursi Partai Golkar di Jawa Timur mulai level DPRD kabupaten/kota, DPRD provinsi, dan DPR RI di Pemilu 2024 ini.  Anies"
Pemilu 2024 adalah yg terburuk,Suporter Demokrasi,0,0,0,2024-03-06T01:23:18.000Z,Pemilu 2024 adalah yg terburuk
"Feri Amsari, Pakar Hukum Tata Negara pertanyakan penggelembungan suara Partai Solidaritas Indonesia (PSI). Bahkan dirinya mengibaratkan terbitnya matahari dari barat jika PSI melampaui 4% suara dalam Pemilu 2024.

Yang artinya PSI dapat lolos dan melaju ke Senayan. Dengan",iNews,0,0,0,2024-03-06T01:52:26.000Z,"Feri Amsari, Pakar Hukum Tata Negara pertanyakan penggelembungan suara Partai Solidaritas Indonesia (PSI). Bahkan dirinya mengibaratkan terbitnya matahari dari barat jika PSI melampaui 4% suara dalam Pemilu 2024.  Yang artinya PSI dapat lolos dan melaju ke Senayan. Dengan"
"Pakar Komunikasi Politik Effendi Gazali mengaku harus tetap mengapresisi jalannya Pemilu 2024 walaupun pada bagian-bagian tertentu harus mendapat kritikan.

Effendi Gazali juga menyinggung Pemilu 2024 kebetulan dengan hadirnya dua film fenomenal yakni 'Dirty Vote' dan 'Agak",iNews,0,0,0,2024-03-06T01:53:34.000Z,Pakar Komunikasi Politik Effendi Gazali mengaku harus tetap mengapresisi jalannya Pemilu 2024 walaupun pada bagian-bagian tertentu harus mendapat kritikan.  Effendi Gazali juga menyinggung Pemilu 2024 kebetulan dengan hadirnya dua film fenomenal yakni 'Dirty Vote' dan 'Agak
"Ketua DPP PSI, Cheryl Tanzil buka-bukaan soal mereka tahu ada partai yang sebenarnya nyaris tak lolos ke Senayan. Tapi mulai bergerilya membeli suara. 

Cheryl memastikan PSI bukanlah partai yang seperti itu. PSI melalui Kaesang Pangarep ingin menang Pemilu 2024 dengan cara",iNews,0,0,1,2024-03-06T02:32:16.000Z,"Ketua DPP PSI, Cheryl Tanzil buka-bukaan soal mereka tahu ada partai yang sebenarnya nyaris tak lolos ke Senayan. Tapi mulai bergerilya membeli suara.   Cheryl memastikan PSI bukanlah partai yang seperti itu. PSI melalui Kaesang Pangarep ingin menang Pemilu 2024 dengan cara"
Patroli dialogis yang humanis unit Samapta Polsek Pancoran Aiptu Jamari tingkatkan Silaturrahmi sampaikan Pesan Kamtibmas dan Call Center 110 kepada warga untuk menciptakan situasi yg aman dan kondusif usai Pemilu 2024.,Polsek Pancoran,0,0,0,2024-03-06T02:46:17.000Z,Patroli dialogis yang humanis unit Samapta Polsek Pancoran Aiptu Jamari tingkatkan Silaturrahmi sampaikan Pesan Kamtibmas dan Call Center 110 kepada warga untuk menciptakan situasi yg aman dan kondusif usai Pemilu 2024.
"Bakesbangpol Jawa Timur Eddy Supriyanto menegaskan, tingkat partisipasi warga Jatim dalam Pemilu 2024 mencapai 82 persen lebih. Angka ini bahkan berpotensi akan bertambah seiring dengan proses rekapitulasi yang masih berlangsung di KPU.

Fitra Eri Ini X",surabayapagi.id,0,0,0,2024-03-06T02:45:32.000Z,"Bakesbangpol Jawa Timur Eddy Supriyanto menegaskan, tingkat partisipasi warga Jatim dalam Pemilu 2024 mencapai 82 persen lebih. Angka ini bahkan berpotensi akan bertambah seiring dengan proses rekapitulasi yang masih berlangsung di KPU.  Fitra Eri Ini X"
"Rabu, 06 Maret 2024
Pukul 10.00 wita s/d selesai

Kapolsek Pringgasela IPDA ARI TRI WIBOWO,SH melaksanakan giat silaturrahmi ke tokoh masyarakat dusun batu tepong desa pengadangan dalam rangka harkamtibmas paska pemilu 2024, situasi terpantau aman terkendali.

#Polri_presisi",Sektor Pringgasela,0,0,0,2024-03-06T03:23:24.000Z,"Rabu, 06 Maret 2024 Pukul 10.00 wita s/d selesai  Kapolsek Pringgasela IPDA ARI TRI WIBOWO,SH melaksanakan giat silaturrahmi ke tokoh masyarakat dusun batu tepong desa pengadangan dalam rangka harkamtibmas paska pemilu 2024, situasi terpantau aman terkendali.   "
"Provinsi lain berharap kemajuannya seperti Jkt, apa diperhatiin sm pemimpinnya. Dikasihlah kesempatan lewat pemilu 2024, eh malah yg di Jkt nya sendiri malah minta kemunduran. Ya udahlah.",A. Arif,0,0,2,2024-03-06T03:00:13.000Z,"Provinsi lain berharap kemajuannya seperti Jkt, apa diperhatiin sm pemimpinnya. Dikasihlah kesempatan lewat pemilu 2024, eh malah yg di Jkt nya sendiri malah minta kemunduran. Ya udahlah."
Tetap Terus Jaga Kerukunan Dan Persaudaraan Pasca Pemilu 2024,Qory Amalia,0,0,1,2024-03-06T03:19:52.000Z,Tetap Terus Jaga Kerukunan Dan Persaudaraan Pasca Pemilu 2024
Pantau Situasi Kamtibmas Tahap Pleno Terbuka Pemilu 2024 Polsek Denbar Giatkan Bluelight Patrol,Humas Polresta Denpasar,0,0,0,2024-03-06T03:01:03.000Z,Pantau Situasi Kamtibmas Tahap Pleno Terbuka Pemilu 2024 Polsek Denbar Giatkan Bluelight Patrol
"Tampilan Situs Real Count KPU Berubah, Tak Ada Lagi Diagram Hasil Pemilu 2024 http://dlvr.it/T3gSrn #Pemilu",LIPUTAN6,0,0,0,2024-03-06T03:21:07.000Z,"Tampilan Situs Real Count KPU Berubah, Tak Ada Lagi Diagram Hasil Pemilu 2024   "
"KAPOLSEK BREBES BERSAMA ANGGOTA SAMBANG TOKOH MASYARAKAT BERIKAN PESAN KAMTIBMAS USAI PEMILU 2024

Kapolsek Brebes AKP Mulyono, S.H., M.H. bersama Kanit Binmas  sambang dan penggalangan kepada Tokoh Masyarakat Kepala Sekolah SDN 1 Brebes, Rabu (06/03/2024).

#polresbrebes",Polres Brebes,0,0,0,2024-03-06T03:10:36.000Z,"KAPOLSEK BREBES BERSAMA ANGGOTA SAMBANG TOKOH MASYARAKAT BERIKAN PESAN KAMTIBMAS USAI PEMILU 2024  Kapolsek Brebes AKP Mulyono, S.H., M.H. bersama Kanit Binmas  sambang dan penggalangan kepada Tokoh Masyarakat Kepala Sekolah SDN 1 Brebes, Rabu (06/03/2024).   "
"Lain DPR-RI, lain Dewan Perwakilan Daerah (DPD) RI. Dalam rapat paripurna ke-9 Masa Sidang IV Tahun Sidang 2023-2024, disepakati pembentukan panitia khusus (pansus) kecurangan pemilu 2024.

Fitra Eri Ganjar Anies Jokowi Ini X #amel #herubudi #Celine",surabayapagi.id,0,0,0,2024-03-06T02:58:56.000Z,"Lain DPR-RI, lain Dewan Perwakilan Daerah (DPD) RI. Dalam rapat paripurna ke-9 Masa Sidang IV Tahun Sidang 2023-2024, disepakati pembentukan panitia khusus (pansus) kecurangan pemilu 2024.  Fitra Eri Ganjar Anies Jokowi Ini X      "
"Mengenai hak angket dugaan kecurangan Pemilu 2024, PDIP melihat sebagai hal yang diperlukan. Namun, hak angket tersebut masih perlu dikaji secara mendalam lagi, untuk mengusut dugaan kecurangan Pemilu 2024 tersebut. (ist)
#BeritaPolitik",Tribunnews.com,0,0,0,2024-03-06T03:17:00.000Z,"Mengenai hak angket dugaan kecurangan Pemilu 2024, PDIP melihat sebagai hal yang diperlukan. Namun, hak angket tersebut masih perlu dikaji secara mendalam lagi, untuk mengusut dugaan kecurangan Pemilu 2024 tersebut. (ist)  "
"Gerakan rakyat Papua Barat Daya tolak hak angket dan serukan dukung pemilu 2024

Shani Fitra Eri Ganjar Ini X Karina Nabrak Jam 4 Anies TikTok Taliban Indonesia     rakyattolak hakangket Meta KJMU",Efrita Anggraini,0,1,1,2024-03-06T03:21:16.000Z,Gerakan rakyat Papua Barat Daya tolak hak angket dan serukan dukung pemilu 2024  Shani Fitra Eri Ganjar Ini X Karina Nabrak Jam 4 Anies TikTok Taliban Indonesia     rakyattolak hakangket Meta KJMU
"Jawab Kecurigaan Publik Soal Kecurangan Pemilu 2024, Legislator PKS Dorong Hak Angket http://dlvr.it/T3gSzR",PKS Muktiwari,0,0,0,2024-03-06T03:21:39.000Z,"Jawab Kecurigaan Publik Soal Kecurangan Pemilu 2024, Legislator PKS Dorong Hak Angket "
"Masyarakat harus mengetahui tentang tata cara menghadapi tantangan hoaks, terutama di tahun pemilu.

#Pemilu2024
#PemiluDamai2024
#PemiluDamaiNegeriMaju
#Pemilu2024BebasHoaks
#Pemilu2024MenujuIndonesiaMaju",Titah Pandita,0,0,0,2024-03-06T02:30:34.000Z,"Masyarakat harus mengetahui tentang tata cara menghadapi tantangan hoaks, terutama di tahun pemilu.           "
"Partisipasi Pemilih Pemilu 2024 di Kabupaten Serang Meningkat Jadi 85,3 Persen Aman dan Damai",PEMILU DAMAI KITA,0,0,0,2024-03-06T02:01:29.000Z,"Partisipasi Pemilih Pemilu 2024 di Kabupaten Serang Meningkat Jadi 85,3 Persen Aman dan Damai"
Perludem berharap penggunaan hak angket DPR RI untuk menyelidiki dugaan kecurangan Pemilu 2024 tidak dihalangi oleh pimpinan DPR RI.,Kompas.com,0,0,5,2024-03-06T01:58:33.000Z,Perludem berharap penggunaan hak angket DPR RI untuk menyelidiki dugaan kecurangan Pemilu 2024 tidak dihalangi oleh pimpinan DPR RI.
"Top News 4: Peta politik Indonesia usai gelaran pemilu 2024 diperkirakan tak akan lepas dari adanya koalisi besar.

Baca selengkapnya:

Koalisi Besar Diprediksi Bayangi Pemerintahan Baru Pengganti Jokowi

https://katadata.co.id/berita/nasional/65e6a0867d721/koalisi-besar-diprediksi-bayangi-pemerintahan-baru-pengganti-jokowi #Jokowi",Katadata.co.id,1,0,0,2024-03-06T02:13:29.000Z,Top News 4: Peta politik Indonesia usai gelaran pemilu 2024 diperkirakan tak akan lepas dari adanya koalisi besar.  Baca selengkapnya:  Koalisi Besar Diprediksi Bayangi Pemerintahan Baru Pengganti Jokowi    
Diagram Perolehan Suara Pemilu 2024 di Sirekap Mendadak Hilang,Sumbarkita.id,0,0,0,2024-03-06T01:50:00.000Z,Diagram Perolehan Suara Pemilu 2024 di Sirekap Mendadak Hilang
"Aus Hidayat: DPR Harus Dorong Hak Angket Pemilu 2024

|| Aus Hidayat Nur (Anggota Komisi II DPR RI F-PKS)

#fraksipksdprri 
#PKSpembelaRakyat 
#PKSnomor8",Fraksi PKS DPR RI,0,11,23,2024-03-06T01:39:38.000Z,Aus Hidayat: DPR Harus Dorong Hak Angket Pemilu 2024  || Aus Hidayat Nur (Anggota Komisi II DPR RI F-PKS)         
"Dinas Komunikasi dan Informatika (Diskominfo) Kalimantan Barat (Kalbar) mengajak media melawan hoaks yang  muncul pasca pemilihan umum(Pemilu) 2024.

Selengkapnya: https://kalbar.antaranews.com/berita/570021/diskominfo-kalbar-ajak-media-lawan-hoaks-pasca-pemilu",antarakalbar.com,0,0,0,2024-03-06T02:14:45.000Z,Dinas Komunikasi dan Informatika (Diskominfo) Kalimantan Barat (Kalbar) mengajak media melawan hoaks yang  muncul pasca pemilihan umum(Pemilu) 2024.  Selengkapnya: 
"Margarito Kamis menyebut bahwa Pemilu 2024 ini terasa seperti pemilu yang dipilih oleh MPR dengan kata lain seperti kembali di masa orde baru, Margarito menyebutkan bahwa mengenai hal ini harus dipikirkan kembali.

pernyataan tersebut dibantah oleh Haikal dengan menyebut sila ke",iNews,0,0,1,2024-03-06T01:03:35.000Z,"Margarito Kamis menyebut bahwa Pemilu 2024 ini terasa seperti pemilu yang dipilih oleh MPR dengan kata lain seperti kembali di masa orde baru, Margarito menyebutkan bahwa mengenai hal ini harus dipikirkan kembali.  pernyataan tersebut dibantah oleh Haikal dengan menyebut sila ke"
"Dalam rangka meningkatkan kesiapan jajaran Pengawas Pemilu untuk mengawasi hari pemungutan suara, Bawaslu Kabupaten Sleman menyelenggarakan Apel Siaga Pengawasan Pemungutan dan Penghitungan Suara (Putungsura) Pemilu 2024 di Lapangan Denggung pada Minggu, 11 Februari 2024.",Bawaslu Kabupaten Sleman,0,0,0,2024-03-06T03:19:56.000Z,"Dalam rangka meningkatkan kesiapan jajaran Pengawas Pemilu untuk mengawasi hari pemungutan suara, Bawaslu Kabupaten Sleman menyelenggarakan Apel Siaga Pengawasan Pemungutan dan Penghitungan Suara (Putungsura) Pemilu 2024 di Lapangan Denggung pada Minggu, 11 Februari 2024."
"Wapadal Satgas OMB Singgalang 2024 Polres Agam IPDA. Dasril, S.H Cek Dan Kontrol Personil Piket Kantor KPU Kab. Agam, Bawaslu Kab. Agam Dan Gudang Logistik Pemilu 2024.
#polresagam
#divisihumaspolri 
#humaspoldasumbar
#spripimpolri
#spripimpoldasumbar 
#kpuagam 
#bawasluagam",Polres Agam,0,0,0,2024-03-06T03:22:00.000Z,"Wapadal Satgas OMB Singgalang 2024 Polres Agam IPDA. Dasril, S.H Cek Dan Kontrol Personil Piket Kantor KPU Kab. Agam, Bawaslu Kab. Agam Dan Gudang Logistik Pemilu 2024.                 "
"Polres Banjar Memperketat Penjagaan di Gudang Logistik KPUD Kota Banjar

Dalam Rangka Operasi Mantap Brata Lodaya pengamanan Pemilu 2024, Polres Banjar melaksanakan pengamanan di Gudang Logistik KPU Kota Banjar. (06/03/2024).",Polres Banjar Polda Jabar,0,0,0,2024-03-06T02:20:02.000Z,"Polres Banjar Memperketat Penjagaan di Gudang Logistik KPUD Kota Banjar  Dalam Rangka Operasi Mantap Brata Lodaya pengamanan Pemilu 2024, Polres Banjar melaksanakan pengamanan di Gudang Logistik KPU Kota Banjar. (06/03/2024)."
"Dia bilang Pemilu 2024 berjalan baik, wkwkw. Ya karena dia diuntungkan oleh pengkondisian/kecurangan yang TSM. Bapak ini semakin tidak relevan",nana,0,0,0,2024-03-06T02:38:49.000Z,"Dia bilang Pemilu 2024 berjalan baik, wkwkw. Ya karena dia diuntungkan oleh pengkondisian/kecurangan yang TSM. Bapak ini semakin tidak relevan"
Sejumlah persoalan ditemukan di dalam penyelenggaraan Pemilu 2024 di Kuala Lumpur. KPU pun berencana menyelenggarakan pemungutan suara ulang di sana.,Kompas.com,0,1,3,2024-03-06T01:00:05.000Z,Sejumlah persoalan ditemukan di dalam penyelenggaraan Pemilu 2024 di Kuala Lumpur. KPU pun berencana menyelenggarakan pemungutan suara ulang di sana.
"waspada provokasi pasca Pemilu 2024
#PemiluIndonesia harus terus menghadirkan kerukunan dan kedamaian #PemiluJujur

Pagiii Indonesia Jokowi Anies Ganjar Covid
#instagramdown #facebookdown
KJMU Meta karina
#GaransiTepatWaktudariShopee",Nayila,17,0,16,2024-03-06T01:49:09.000Z,waspada provokasi pasca Pemilu 2024   harus terus menghadirkan kerukunan dan kedamaian    Pagiii Indonesia Jokowi Anies Ganjar Covid     KJMU Meta karina  
"Situasi di Indonesia saat ini masih naik dan semua diharapkan tetap menjaga suasana kondusif.

#Pemilu2024BebasHoaks
#Pemilu2024
#PemiluDamai2024
#Pemilu2024MenujuIndonesiaMaju
#PemiluDamaiNegeriMaju",Titah Pandita,0,0,0,2024-03-06T02:20:06.000Z,Situasi di Indonesia saat ini masih naik dan semua diharapkan tetap menjaga suasana kondusif.           
Pemilu 2024..pemilu paling kotor yang pernah aku ikuti...,Anak kampoeng,0,0,0,2024-03-06T02:11:40.000Z,Pemilu 2024..pemilu paling kotor yang pernah aku ikuti...
"Anomali: survey Litbang Kompas menunjukkan lebih dari 60% masyarakat setuju dilakukannya Hak Angket.

Betul. Suara 02 jauh dari kontestan lain, tapi kecurangan yang ada bukan berarti jadinya harus tutup mata. Apalagi ada indikasi masalah juga di suara PSI.

#pemilu2024",Nina Nnha,0,0,0,2024-03-06T01:45:02.000Z,"Anomali: survey Litbang Kompas menunjukkan lebih dari 60% masyarakat setuju dilakukannya Hak Angket.  Betul. Suara 02 jauh dari kontestan lain, tapi kecurangan yang ada bukan berarti jadinya harus tutup mata. Apalagi ada indikasi masalah juga di suara PSI.   "
"Akhirnya DPD bergerak, Pansus Kecurangan Pemilu adalah bentuk perlawanan terhadap kecurangan dan ketidakadilan dalam Kontestasi Pemilu 2024. Ada banyak tanya yang belum terjawab, misteri yang melibatkan banyak pihak sehingga kecenderungan TSM itu bukan mustahil. 
#menyaladpd ",K'Tua Ethnic,0,0,4,2024-03-06T00:58:28.000Z,"Akhirnya DPD bergerak, Pansus Kecurangan Pemilu adalah bentuk perlawanan terhadap kecurangan dan ketidakadilan dalam Kontestasi Pemilu 2024. Ada banyak tanya yang belum terjawab, misteri yang melibatkan banyak pihak sehingga kecenderungan TSM itu bukan mustahil.    "
"Pemilu 2024, Partisipasi Pemilih di Gunungkidul Mencapai 85 Persen https://jogjapolitan.harianjogja.com/read/2024/03/06/513/1167045/pemilu-2024-partisipasi-pemilih-di-gunungkidul-mencapai-85-persen?utm_source=dlvr.it&utm_medium=twitter #beritajogja #jogja #jogjaistimewa",Harian Jogja,0,0,0,2024-03-06T02:53:06.000Z,"Pemilu 2024, Partisipasi Pemilih di Gunungkidul Mencapai 85 Persen       "
"Pemilu 2024 yang dinilai banyak masalah jangan sampai meruntuhkan tatanan demokrasi di Indonesia.

Nonton episode #VISINEGARAWAN ""Nurani Demokrasi"" selengkapnya di https://youtu.be/Bfjsz3-eukA 

#visinegarawanmetrotv #demokrasiindonesia #pilpres2024 #pemilu2024",METRO TV,0,1,0,2024-03-06T02:38:01.000Z,"Pemilu 2024 yang dinilai banyak masalah jangan sampai meruntuhkan tatanan demokrasi di Indonesia.  Nonton episode   ""Nurani Demokrasi"" selengkapnya di           "
Bawaslu Kabupaten Bogor Temukan Penggelembungan Suara Pemilu 2024 di Sejumlah Kecamatan,erakini media,0,0,0,2024-03-06T01:20:09.000Z,Bawaslu Kabupaten Bogor Temukan Penggelembungan Suara Pemilu 2024 di Sejumlah Kecamatan
"Daftar Caleg Terpilih DPRD Gianyar: PDIP Raih Rekor Kemenangan dalam Pemilu 2024, Perindo Loloskan Satu Orang",Jembrana Express,0,0,0,2024-03-06T02:10:36.000Z,"Daftar Caleg Terpilih DPRD Gianyar: PDIP Raih Rekor Kemenangan dalam Pemilu 2024, Perindo Loloskan Satu Orang"
"Grafik Hasil Pemilu 2024 Ditutup KPU, Sirekap Jadi Trending Topik di X https://pemilu2024.harianjogja.com/read/2024/03/06/643/1167044/grafik-hasil-pemilu-2024-ditutup-kpu-sirekap-jadi-trending-topik-di-x?utm_source=dlvr.it&utm_medium=twitter #beritajogja #jogja #jogjaistimewa",Harian Jogja,0,1,1,2024-03-06T02:44:05.000Z,"Grafik Hasil Pemilu 2024 Ditutup KPU, Sirekap Jadi Trending Topik di X       "
"Rekonsiliasi nasional pasca pemilu penting untuk menghindari potensi adanya polarisasi lebih lanjut yang dilakukan oleh kaum elite maupun grassroots.

#Pemilu2024
#PemiluDamai2024
#PemiluDamaiNegeriMaju
#Pemilu2024BebasHoaks
#Pemilu2024MenujuIndonesiaMaju",Titah Pandita,0,0,0,2024-03-06T02:28:18.000Z,Rekonsiliasi nasional pasca pemilu penting untuk menghindari potensi adanya polarisasi lebih lanjut yang dilakukan oleh kaum elite maupun grassroots.           
mu nanya prof. apa menurut anda pemilu 2024 berjalan baik2 saja tanpa ada campur tangan pihak2 yg terkait  ?  ...,RHDewa,0,0,0,2024-03-06T02:16:09.000Z,mu nanya prof. apa menurut anda pemilu 2024 berjalan baik2 saja tanpa ada campur tangan pihak2 yg terkait  ?  ...
"Partisipasi Pemilih Pemilu 2024 di Kabupaten Serang Meningkat Jadi 85,3 Persen Aman dan Damai - Kabarklik
#BeritaTerkini #News #NewsUpdate #KabarKlik",kabarKlik.com,0,0,0,2024-03-06T01:50:00.000Z,"Partisipasi Pemilih Pemilu 2024 di Kabupaten Serang Meningkat Jadi 85,3 Persen Aman dan Damai - Kabarklik        "
#IniKebumen #Pemilu2024 #PDIP,INIKEBUMEN.COM,0,0,0,2024-03-06T01:48:51.000Z,     
"Setiap pilihan memiliki nilai, mari kita tetap bersatu dan menghormati hasil Pemilu 2024.",Anugrah Wiranto,0,0,0,2024-03-06T01:38:12.000Z,"Setiap pilihan memiliki nilai, mari kita tetap bersatu dan menghormati hasil Pemilu 2024."
"Budaya politik untuk memilih pemimpin berdasarkan visi misi dan rekam jejak harus dikembangkan di Indonesia.

Nonton episode #VISINEGARAWAN ""Nurani Demokrasi"" selengkapnya di https://youtu.be/Bfjsz3-eukA 

#visinegarawanmetrotv #demokrasiindonesia #pilpres2024 #pemilu2024",METRO TV,0,5,5,2024-03-06T02:29:46.000Z,"Budaya politik untuk memilih pemimpin berdasarkan visi misi dan rekam jejak harus dikembangkan di Indonesia.  Nonton episode   ""Nurani Demokrasi"" selengkapnya di           "
Pemilu 2024 pemilu yg memalukan..semua instrumen di mainkan hanya untuk seoarang anak haram konstitusi ..tiada kata selain..LAWAN,toba barli,0,0,0,2024-03-06T03:16:26.000Z,Pemilu 2024 pemilu yg memalukan..semua instrumen di mainkan hanya untuk seoarang anak haram konstitusi ..tiada kata selain..LAWAN
"Rapat Koordinasi Persiapan Penghitungan Suara Tingkat Kota Probolingo

Kantor Kecamatan Kanigaran, 25 Februari 2024
.
KPU Melayani, Integritas 24 jam 
____________________
#pemiluserentak2024 
#pemilu2024 
#kpuri
#kpijatim
#kpukotaprobolinggo 
#ppkkanigaran",PPS Kebonsari Wetan 2024,0,0,1,2024-03-05T13:40:05.000Z,"Rapat Koordinasi Persiapan Penghitungan Suara Tingkat Kota Probolingo  Kantor Kecamatan Kanigaran, 25 Februari 2024 . KPU Melayani, Integritas 24 jam  ____________________               "
Sy bangga dgn pemilu 2024 yg semakin Culas..,DFD,0,0,1,2024-03-05T23:46:07.000Z,Sy bangga dgn pemilu 2024 yg semakin Culas..
Bertepatan dgn pengumuman hasil pemilu 2024,aditya,0,0,1,2024-03-05T16:26:17.000Z,Bertepatan dgn pengumuman hasil pemilu 2024
"@1_kompas
 *Putusan Sidang Paripurna: DPD RI Bentuk Pansus Kecurangan Pemilu 2024*
 https://kompas1.net/putusan-sidang-paripurna-dpd-ri-bentuk-pansus-kecurangan-pemilu-2024/",Zurfami Joman,0,0,0,2024-03-05T20:09:58.000Z,   *Putusan Sidang Paripurna: DPD RI Bentuk Pansus Kecurangan Pemilu 2024*  
"Indonesia harus diselamatkan, gantung mati para pengkhianat konstitusi yg ingin merampok hasil Pemilu 2024, Pemilu tercurang paling brutal dalam sejarah RI.
#Pemilu2024MilikRakyatRI 
#Pemilu2024MilikRakyatRI",𝗙𝗥𝗘𝗘𝗗𝗢𝗠𝗟𝗔𝗡𝗗 3131,2,52,62,2024-03-05T15:05:35.000Z,"Indonesia harus diselamatkan, gantung mati para pengkhianat konstitusi yg ingin merampok hasil Pemilu 2024, Pemilu tercurang paling brutal dalam sejarah RI.     "
"Kecurangan PEMILU 2024 ini sesungguhnya sudah jauh jauh hari saya katakan PASTI ADA KECURANGAN yang berdasar kepada pengalaman 2014 dan 2019, itu sudah saya gembor gemborkan via komentar di setiap sosmed yang memuat survei. Namun siap sih saya yang tidak ada apa apanya ","gunawan,MrHari",0,0,0,2024-03-05T15:56:20.000Z,"Kecurangan PEMILU 2024 ini sesungguhnya sudah jauh jauh hari saya katakan PASTI ADA KECURANGAN yang berdasar kepada pengalaman 2014 dan 2019, itu sudah saya gembor gemborkan via komentar di setiap sosmed yang memuat survei. Namun siap sih saya yang tidak ada apa apanya "
"Anggota Komisi VI DPR RI Fraksi PKB, Luluk Nur Hamidah, menegaskan tidak boleh ada satu pihakpun yang mencoba memobilisasi sumber daya negara untuk memenangkan satu pihak dalam Pemilu 2024.
Pemilu tidak bisa hanya dipandang dalam konteks hasil, lebih dari itu, konteks proses",Media Indonesia,0,3,3,2024-03-05T11:23:10.000Z,"Anggota Komisi VI DPR RI Fraksi PKB, Luluk Nur Hamidah, menegaskan tidak boleh ada satu pihakpun yang mencoba memobilisasi sumber daya negara untuk memenangkan satu pihak dalam Pemilu 2024. Pemilu tidak bisa hanya dipandang dalam konteks hasil, lebih dari itu, konteks proses"
"DPR RI berpeluang mengajukan Hak angket dalam sidang Paripurna DPR RI terkait dugaan kecurangan Pilpres 2024. Lalu apa saja syarat dan ketentuan Hak Angket, simak selengkapnya.  NNN 

#iNews #iNewsSore #HakAngket #DPR #DPRRI #Indonesia #Pemilu2024 #KecuranganPemilu2024",iNews,0,0,1,2024-03-05T13:30:00.000Z,"DPR RI berpeluang mengajukan Hak angket dalam sidang Paripurna DPR RI terkait dugaan kecurangan Pilpres 2024. Lalu apa saja syarat dan ketentuan Hak Angket, simak selengkapnya.  NNN                  "
"Sikapi Dinamika Politik Jelang Pemilu 2024, Gubes dan Sivitas Unesa Serukan Kawal Demokrasi",News Channel,0,0,0,2024-03-05T23:03:39.000Z,"Sikapi Dinamika Politik Jelang Pemilu 2024, Gubes dan Sivitas Unesa Serukan Kawal Demokrasi"
"Yusuf Lakaseng: Suara Masyarakat adalah Amanah, Harus Dijaga

*S

#PerindoUpdate #PartaiPerindo #Perindo #YusufLakaseng #Pemilu2024 #Pilpres2024 #Pileg2024",Partai Perindo,0,0,2,2024-03-05T14:21:15.000Z,"Yusuf Lakaseng: Suara Masyarakat adalah Amanah, Harus Dijaga  *S               "
"Pembubaran KPPS Se Kebonsari Wetan 

Rumah Anggota KPPS, 26 Februari 2024
.
KPU Melayani, Integritas 24 jam 
____________________
#pemiluserentak2024 
#pemilu2024 
#kpuri
#kpijatim
#kpukotaprobolinggo 
#ppkkanigaran
#ppskebonsariwetan
#bawaslukotaprobolinggo
#pantarlih2024",PPS Kebonsari Wetan 2024,0,0,1,2024-03-05T13:54:08.000Z,"Pembubaran KPPS Se Kebonsari Wetan   Rumah Anggota KPPS, 26 Februari 2024 . KPU Melayani, Integritas 24 jam  ____________________                     "
"Didorong Loyalis Anies, DPD RI Bikin Pansus Kecurangan Pemilu 2024",VivaCoid,6,37,161,2024-03-05T13:40:34.000Z,"Didorong Loyalis Anies, DPD RI Bikin Pansus Kecurangan Pemilu 2024"
Sama bang. Malah ada postingan karena pemilu 2024 ,siTaqim,0,0,0,2024-03-05T16:15:04.000Z,Sama bang. Malah ada postingan karena pemilu 2024 
"Rapat DPR soal hak angket, DPR membara.

Fraksi PKB:
""Pemilu 2024 ini sangat brutal dan menyakitkan. 
Pemilu adalah hak rakyat. Tidak boleh ada yg merampas.
Pemilu tidak hanya dipandang sbg hasil tapi juga proses.""

5 Maret 2024

#Pemilu2024MilikRakyatRI 
#Pemilu2024MilikRakyatRI",dancersejati07,1,6,9,2024-03-05T18:55:59.000Z,"Rapat DPR soal hak angket, DPR membara.  Fraksi PKB: ""Pemilu 2024 ini sangat brutal dan menyakitkan.  Pemilu adalah hak rakyat. Tidak boleh ada yg merampas. Pemilu tidak hanya dipandang sbg hasil tapi juga proses.""  5 Maret 2024      "
Tampilan web pemilu 2024 ada yg beruubah...,Syamsudin Jaya,0,0,0,2024-03-05T23:36:42.000Z,Tampilan web pemilu 2024 ada yg beruubah...
"DEMI NKRI,
TOLAK KECURANGAN PEMILU 2024

Lupakan:
KPU
Bawaslu

Karena Saat Ini Mereka Sudah Digenggaman Rezim Penguasa

FOKUS Ke Perjuangan HAK ANGKET Di DPR RI.
Lewat HAK ANGKET, Akan Terungkap Semua KEBUSUKAN & KECURANGAN PEMILU 2024

#FokusHakAngket
#DukungHakAngketDPR",Muslim_AntiPKI9,8,54,83,2024-03-05T11:43:54.000Z,"DEMI NKRI, TOLAK KECURANGAN PEMILU 2024  Lupakan: KPU Bawaslu  Karena Saat Ini Mereka Sudah Digenggaman Rezim Penguasa  FOKUS Ke Perjuangan HAK ANGKET Di DPR RI. Lewat HAK ANGKET, Akan Terungkap Semua KEBUSUKAN & KECURANGAN PEMILU 2024     "
