text,author,reply,retweet,like,date,cleaned_text
"Proses Pengembalian Logistik Pemilu 2024 Berlangsung Lancar

Tahapan demokrasi mencapai puncaknya dengan suksesnya proses pengembalian logistik pemilu 2024. Berbagai pihak terkait turut hadir untuk memastikan.

FB IG Devina Amel Ganjar
Fitra Eri Heru Budi Ini X",Entien Ajach,2,10,10,2024-03-05T23:48:02.000Z,Proses Pengembalian Logistik Pemilu 2024 Berlangsung Lancar  Tahapan demokrasi mencapai puncaknya dengan suksesnya proses pengembalian logistik pemilu 2024. Berbagai pihak terkait turut hadir untuk memastikan.  FB IG Devina Amel Ganjar Fitra Eri Heru Budi Ini X
"Raihan Suara 18 Parpol Peserta Pemilu 2024 Hari Ini: PSI di Atas 3 Persen, 6 Partai Masih di Bawah 1 Persen

https://literasi-online.com/2024/03/05/raihan-suara-18-parpol-peserta-pemilu-2024-hari-ini-psi-di-atas-3-persen-6-partai-masih-di-bawah-1-persen",Literasi Online,0,0,0,2024-03-05T13:53:25.000Z,"Raihan Suara 18 Parpol Peserta Pemilu 2024 Hari Ini: PSI di Atas 3 Persen, 6 Partai Masih di Bawah 1 Persen  "
"Di DPRD Solo, PSI berpotensi memperoleh lima kursi pada Pemilu 2024. Jumlahnya meningkat lima kali lipat. Kedekatan dg keluarga Jokowi dinilai ikut mempengaruhi lonjakan elektabilitas partai yang dipimpin si bungsu, Kaesang Pangarep. 

Simak selengkapnya:",Nino CA,0,1,2,2024-03-05T16:04:22.000Z,"Di DPRD Solo, PSI berpotensi memperoleh lima kursi pada Pemilu 2024. Jumlahnya meningkat lima kali lipat. Kedekatan dg keluarga Jokowi dinilai ikut mempengaruhi lonjakan elektabilitas partai yang dipimpin si bungsu, Kaesang Pangarep.   Simak selengkapnya:"
"Semakin jelas terasa klo pemilu 2024 ini banyak tangan setan yang bermain dibelakang layar demi untuk menyesuaikan jalannya cerita seperti yang dikehendaki oleh sang sutradara..

Pakde pancen oye..
Cenasuok.. pokok'e ya hwasuu tenan wes polahe..

",LaKoNe bukan PrEmAn,0,0,2,2024-03-05T18:19:30.000Z,Semakin jelas terasa klo pemilu 2024 ini banyak tangan setan yang bermain dibelakang layar demi untuk menyesuaikan jalannya cerita seperti yang dikehendaki oleh sang sutradara..  Pakde pancen oye.. Cenasuok.. pokok'e ya hwasuu tenan wes polahe..  
"MELALUI HAK ANGKET DPR AKAN MENEMUKAN TITIK TERANG KECURANGAN KPU dan Mukidi Dalam PEMILU 2024, Rakyat Harus LAWAN Penguasa Yang Merusak Demokrasi di Republik Indonesia ini.
#PemiluCurang #PenyalahgunaanKekuasaan #MahkamahKeluarga #jokowi",Hasian,0,0,0,2024-03-05T17:14:57.000Z,"MELALUI HAK ANGKET DPR AKAN MENEMUKAN TITIK TERANG KECURANGAN KPU dan Mukidi Dalam PEMILU 2024, Rakyat Harus LAWAN Penguasa Yang Merusak Demokrasi di Republik Indonesia ini.        "
"Komisi Pemilihan Umum Daerak (KPUD) Kabupaten Subang, dalam rangka menggelar Rapat pleno rekapitulasi hasil penghitungan dan penetepan perolehan suara Pemilu 2024.

Baca selengkapnya di http://timenews.co.id
#kabarterkini #terpercaya #promedia",TIMENEWS.CO.ID,0,0,0,2024-03-06T00:02:32.000Z,"Komisi Pemilihan Umum Daerak (KPUD) Kabupaten Subang, dalam rangka menggelar Rapat pleno rekapitulasi hasil penghitungan dan penetepan perolehan suara Pemilu 2024.  Baca selengkapnya di       "
"BONGKAR Kecurangan Pilpres Pemilu 2024, Tangkap Semua Komisioner KPU dan Makzulkan si Mukidi, Diskualifikasi Paslon 02.",Hasian,0,0,0,2024-03-05T17:00:20.000Z,"BONGKAR Kecurangan Pilpres Pemilu 2024, Tangkap Semua Komisioner KPU dan Makzulkan si Mukidi, Diskualifikasi Paslon 02."
"Real count Pemilu 2024 sudah memasuki tahap akhir, banyak caleg yg sudah dipastikan gagal meraih kursi 

Berikut #JadiUtas
KUMPULAN BERITA CALEG GAGAL & BERUJUNG D*PRESI",Sipaling viral,1,0,1,2024-03-05T13:37:45.000Z,"Real count Pemilu 2024 sudah memasuki tahap akhir, banyak caleg yg sudah dipastikan gagal meraih kursi   Berikut   KUMPULAN BERITA CALEG GAGAL & BERUJUNG D*PRESI"
"Alasannya Pengen bahas strategi pengeboman ke Israel, plus pengen ngbrol soal pemilu 2024, pengen bahas jokes yang katanya booming eh taunya lagi love bombing",Rahman munawar,0,0,0,2024-03-05T16:21:34.000Z,"Alasannya Pengen bahas strategi pengeboman ke Israel, plus pengen ngbrol soal pemilu 2024, pengen bahas jokes yang katanya booming eh taunya lagi love bombing"
"Dalam upaya Mencegah segala potensi gangguan saat tahap pleno rekapitulasi suara Pemilu 2024 tingkat Provinsi yang mulai berlangsung sejak hari ini, Selasa (05/02) di Hotel Lombok Garden, Kota Mataram. 
#poldantb 
#polrikawalpemiluamandamai",POLDA NTB,1,0,1,2024-03-06T00:24:11.000Z,"Dalam upaya Mencegah segala potensi gangguan saat tahap pleno rekapitulasi suara Pemilu 2024 tingkat Provinsi yang mulai berlangsung sejak hari ini, Selasa (05/02) di Hotel Lombok Garden, Kota Mataram.      "
Mgkn dia gak dapet info ttg buanyaknya berita keganjilan2 dalam pemilu 2024.,GrowAsWeGo,0,0,0,2024-03-05T14:35:21.000Z,Mgkn dia gak dapet info ttg buanyaknya berita keganjilan2 dalam pemilu 2024.
Tiga Parpol di DIY Dukung DPR RI Gulirkan Hak Angket Pemilu 2024 https://jogjapolitan.harianjogja.com/read/2024/03/05/510/1166975/tiga-parpol-di-diy-dukung-dpr-ri-gulirkan-hak-angket-pemilu-2024?utm_source=dlvr.it&utm_medium=twitter #beritajogja #jogja #jogjaistimewa,Harian Jogja,0,0,0,2024-03-05T12:20:07.000Z,Tiga Parpol di DIY Dukung DPR RI Gulirkan Hak Angket Pemilu 2024       
"Bongkar 'Borok' Pemilu 2024, PPP Beberkan Rangkaian Operasi Penggelembungan Suara PSI",Repelita Online,0,0,0,2024-03-05T11:29:09.000Z,"Bongkar 'Borok' Pemilu 2024, PPP Beberkan Rangkaian Operasi Penggelembungan Suara PSI"
"Saya 100% mendukung hak angket kecurangan pemilu. Krn wakil rakyat di Senayan dibayar oleh rakyat utk menunjukkan kelihaian menyelesaikan dugaan masalah bangsa, c.q. pelaksanaan pemilu 2024.",samsudin adlawi,1,1,2,2024-03-06T00:41:41.000Z,"Saya 100% mendukung hak angket kecurangan pemilu. Krn wakil rakyat di Senayan dibayar oleh rakyat utk menunjukkan kelihaian menyelesaikan dugaan masalah bangsa, c.q. pelaksanaan pemilu 2024."
"Selalu hadir untuk menjamin seluruh tahapan pemilu 2024 berjalan aman dan lancar
#spripimpolri
#divisihumaspolri
#poldantt
#polresflotim",HumasResFlotim,0,0,1,2024-03-06T00:48:35.000Z,Selalu hadir untuk menjamin seluruh tahapan pemilu 2024 berjalan aman dan lancar        
"Riak2 kecil katanya TAPI SHOW OFF kepanikan.. semua rakyat bersuara TOLAK PEMILU 2024 !!

Kasian 02 GAGAL DILANTIK ! Sokoooooriiiin.. ",Dosh,1,1,19,2024-03-05T13:27:48.000Z,Riak2 kecil katanya TAPI SHOW OFF kepanikan.. semua rakyat bersuara TOLAK PEMILU 2024 !!  Kasian 02 GAGAL DILANTIK ! Sokoooooriiiin.. 
"Selanjutnya tahapan rekapitulasi hasil penghitungan suara akan dilakukan berjenjang mulai dari rekapitulasi di Kecamatan, Kabupaten/Kota, Provinsi, dan Nasional. Hasil rekapitulasi manual berjenjang tersebut dijadikan sebagai hasil resmi pemilihan umum (pemilu) 2024.",Loli,0,4,4,2024-03-05T23:01:02.000Z,"Selanjutnya tahapan rekapitulasi hasil penghitungan suara akan dilakukan berjenjang mulai dari rekapitulasi di Kecamatan, Kabupaten/Kota, Provinsi, dan Nasional. Hasil rekapitulasi manual berjenjang tersebut dijadikan sebagai hasil resmi pemilihan umum (pemilu) 2024."
"Jangan lupa, guys Pemilu 2024 jadi kesempatan kita buat berkumpul, ya",Fauzan Rizqi,0,0,0,2024-03-05T15:32:38.000Z,"Jangan lupa, guys Pemilu 2024 jadi kesempatan kita buat berkumpul, ya"
FPKB DPR Dorong Hak Angket untuk Hilangkan Dugaan Kecurangan Pemilu 2024,PKBTalk24,0,0,0,2024-03-05T11:50:50.000Z,FPKB DPR Dorong Hak Angket untuk Hilangkan Dugaan Kecurangan Pemilu 2024
"Sebenarnya 
@PDI_Perjuangan
 mendukung Hak Angket KEDZALIMAN PENGUASA di PEMILU 2024 nggak mbak 
@puanmaharani_ri
 .
Nggak usah lagi kerja sama dengan Keluarga Malin Kundang Mbak. Anaknya sendiri sudah bilang secara langsung kedepannya tidak Butuh PARTAI ",Abdul Malik,0,0,3,2024-03-05T11:20:04.000Z,Sebenarnya     mendukung Hak Angket KEDZALIMAN PENGUASA di PEMILU 2024 nggak mbak     . Nggak usah lagi kerja sama dengan Keluarga Malin Kundang Mbak. Anaknya sendiri sudah bilang secara langsung kedepannya tidak Butuh PARTAI 
"Suara Partai Solidaritas Indonesia (PSI) mendadak naik di Sirekap Pemilu 2024 dan di real count sementara KPU.
Lonjakan suara PSI ini pun direspons oleh Tim Pemenangan Nasional Anis Baswedan dan Muhaimin Iskandar (Timnas AMIN). (ld)
#pemilu2024 #PSI #KPU",Tribunnews.com,0,1,1,2024-03-05T13:20:00.000Z,Suara Partai Solidaritas Indonesia (PSI) mendadak naik di Sirekap Pemilu 2024 dan di real count sementara KPU. Lonjakan suara PSI ini pun direspons oleh Tim Pemenangan Nasional Anis Baswedan dan Muhaimin Iskandar (Timnas AMIN). (ld)      
"Sepanjang sejarah pemilu dari tahun 2004 sampai 2019 tak ada pemilu sebrutal dan sebangsat pemilu 2024 era Mukidi yg ambisinya melebihi Suharto Orba. 
Pemilu 2024 terbiadab yg pernah ada dalam Negara Demokrasi ",SAN,0,5,13,2024-03-05T11:28:49.000Z,Sepanjang sejarah pemilu dari tahun 2004 sampai 2019 tak ada pemilu sebrutal dan sebangsat pemilu 2024 era Mukidi yg ambisinya melebihi Suharto Orba.  Pemilu 2024 terbiadab yg pernah ada dalam Negara Demokrasi 
"KPU Bilang tak Ada Penggelembungan Suara PSI

Anggota Komisi Pemilihan Umum (KPU) RI Idham Holik menegaskan,...

#NewsUpdate #Pemilu2024 #KPU #Sirekap #PSI #PenggelembunganSuara",Arahkita Media Network- AKMN,0,0,0,2024-03-05T12:54:37.000Z,"KPU Bilang tak Ada Penggelembungan Suara PSI  Anggota Komisi Pemilihan Umum (KPU) RI Idham Holik menegaskan,...             "
"Nampaknya pemilu 2024 juga menunjukkan ciri2 yg sama, hanya legitimasi kekuasaan orang curang.",Senonoh,0,0,0,2024-03-06T00:06:12.000Z,"Nampaknya pemilu 2024 juga menunjukkan ciri2 yg sama, hanya legitimasi kekuasaan orang curang."
"Benny Sebut Pemilu 2024 Bak Permainan Sepak Bola Kalah-Menang Biasa, Warganet: Jangan Berpihak Kejahatan!",OposisiCerdas.com,1,9,11,2024-03-06T00:06:24.000Z,"Benny Sebut Pemilu 2024 Bak Permainan Sepak Bola Kalah-Menang Biasa, Warganet: Jangan Berpihak Kejahatan!"
"PDIP Kota Serang, tidak merasa mencurangi pada Pemilu 2024, karena hanya sebagai peserta, bukan penyelenggara.

#bambangjanoko #pdipkotaserang #pileg2024",biem.co,0,1,0,2024-03-06T00:01:12.000Z,"PDIP Kota Serang, tidak merasa mencurangi pada Pemilu 2024, karena hanya sebagai peserta, bukan penyelenggara.       "
"Lonjakan Penumpang Mudik Pemilu Terjadi, KAI Tingkatkan Pengamanan KAI mencatat adanya peningkatan volume penumpang memasuki masa pemungutan suara di Pemilu 2024.  #KAITingkatkanPengamanan #keretaapikita",bumnplgjitu,0,0,0,2024-03-05T13:42:34.000Z,"Lonjakan Penumpang Mudik Pemilu Terjadi, KAI Tingkatkan Pengamanan KAI mencatat adanya peningkatan volume penumpang memasuki masa pemungutan suara di Pemilu 2024.     "
Makanya biar nggak balik2 tuh manusia rakyat harus jaga dan kawal ini hak angket buktikan bahwa pemilu 2024 itu pelanggaran TSM. Putaran 2 lanjut 01 vs 03. Krn 02 diskualufikasi,NRR,0,0,0,2024-03-05T16:15:26.000Z,Makanya biar nggak balik2 tuh manusia rakyat harus jaga dan kawal ini hak angket buktikan bahwa pemilu 2024 itu pelanggaran TSM. Putaran 2 lanjut 01 vs 03. Krn 02 diskualufikasi
"Purworejo membangun :Thema setelah pemilu 2024,masalah pertanahan akan di kritisi habis oleh masyarakat.siap WA para Mentri terkait jika ada pelanggaran dilapangan",Doni setiyawan abdullah,0,0,0,2024-03-05T12:07:59.000Z,"Purworejo membangun :Thema setelah pemilu 2024,masalah pertanahan akan di kritisi habis oleh masyarakat.siap WA para Mentri terkait jika ada pelanggaran dilapangan"
"Bawaslu Terus Cermati Rekapitulasi Berjenjang

Anggota Badan Pengawas Pemilu (Bawaslu) RI Lolly Suhenty...

#NewsUpdate #Pemilu2024 #Pilpres2024 #Bawaslu #RekapitulasiSuara",Arahkita Media Network- AKMN,0,0,0,2024-03-05T12:58:08.000Z,Bawaslu Terus Cermati Rekapitulasi Berjenjang  Anggota Badan Pengawas Pemilu (Bawaslu) RI Lolly Suhenty...           
Bawaslu Riau Berharap Pleno Rekapitulasi Suara Tingkat Provinsi Riau Berjalan Lancar http://dlvr.it/T3dxMj #Pemilu_2024,Go Riau,0,0,0,2024-03-05T13:56:35.000Z,Bawaslu Riau Berharap Pleno Rekapitulasi Suara Tingkat Provinsi Riau Berjalan Lancar   
"#PSI #DugaanPenggelembunganSuara #RekapSuara #Pemilu2024  

Ketua DPW Partai Solidaritas Indonesia (PSI) Aceh, Zulkarnaini alias Syeh Joel angkat bicara terakit riuhnya politik nasional atas dugaan penggelembungan suara PSI.

https://aceh.tribunnews.com/2024/03/05/terkait-dugaan-penggelembungan-suara-ketua-dpw-psi-aceh-ada-kepanikan-dari-sebagian-oknum via 
@tribunnews",Serambi Indonesia,0,0,0,2024-03-05T11:10:37.000Z,"           Ketua DPW Partai Solidaritas Indonesia (PSI) Aceh, Zulkarnaini alias Syeh Joel angkat bicara terakit riuhnya politik nasional atas dugaan penggelembungan suara PSI.   via   "
"Sidang Paripurna DPR, Politisi PKB dan PKS Minta Gunakan Hak Angket Usut Dugaan Kecurangan Pemilu https://indopos.co.id/headline/2024/03/05/sidang-paripurna-dpr-politisi-pkb-dan-pks-minta-gunakan-hak-angket-usut-dugaan-kecurangan-pemilu/ #DugaanKecuranganPemilu #HakAngket #Pemilu2024 #PKB #pks #SidangParipurnaDPR",indopos.co.id,0,0,0,2024-03-05T14:35:06.000Z,"Sidang Paripurna DPR, Politisi PKB dan PKS Minta Gunakan Hak Angket Usut Dugaan Kecurangan Pemilu             "
"Sejumlah anggota Dewan Perwakilan Rakyat (DPR) dari Fraksi Partai Kebangkitan Bangsa (PKB), Partai Keadilan Sejahtera (PKS) dan Partai Demokrasi Indonesia Perjuangan (PDIP) mengusulkan penggunaan hak angket terkait dugaan kecurangan Pemilu 2024.",VOA Indonesia,0,0,2,2024-03-05T23:00:02.000Z,"Sejumlah anggota Dewan Perwakilan Rakyat (DPR) dari Fraksi Partai Kebangkitan Bangsa (PKB), Partai Keadilan Sejahtera (PKS) dan Partai Demokrasi Indonesia Perjuangan (PDIP) mengusulkan penggunaan hak angket terkait dugaan kecurangan Pemilu 2024."
"Diskusi Kebangsaan oleh BEM Universitas Sari Mulia Banjarmasin.
Tema kegitan Penguatan wawasan kebangsaan dan cinta tanah air untuk mengantisipasi polarisasi pasca pemilu 2024 dikalangan mahasiswa",Mutia Hasan,0,0,0,2024-03-05T15:58:08.000Z,Diskusi Kebangsaan oleh BEM Universitas Sari Mulia Banjarmasin. Tema kegitan Penguatan wawasan kebangsaan dan cinta tanah air untuk mengantisipasi polarisasi pasca pemilu 2024 dikalangan mahasiswa
"Jujur , saya baru tahu kalau dia walikota Medan...menjelang pemilu 2024",Dani Giberis™,0,0,1,2024-03-05T18:25:13.000Z,"Jujur , saya baru tahu kalau dia walikota Medan...menjelang pemilu 2024"
"Indonesia sedang baik-baik saja, Palestina yang tidak baik-baik saja!

Perkara beras digoreng terus, di sana mau minum aja susah apalagi makan. Lagian beras dimasak bukan digoreng brok! 

#Pemilu2024 #FreePalestine",Ian Pribadi,0,0,0,2024-03-05T21:05:08.000Z,"Indonesia sedang baik-baik saja, Palestina yang tidak baik-baik saja!  Perkara beras digoreng terus, di sana mau minum aja susah apalagi makan. Lagian beras dimasak bukan digoreng brok!      "
"KPU Gelar Rapat Pleno Penghitungan Suara Pemilu 2024 Tingkat Provinsi Papua
https://pojokindo.com/2024/03/05/kpu-gelar-rapat-pleno-penghitungan-suara-pemilu-2024-tingkat-provinsi-papua/",POJOK INDONEWS,0,1,1,2024-03-05T12:20:40.000Z,KPU Gelar Rapat Pleno Penghitungan Suara Pemilu 2024 Tingkat Provinsi Papua 
"Permainan Sepak Bola juga yang banyak mafianya, seperti di Italia (ada pengaturan skor, keberpihakan wasit karena sudah dibayar). Klub yang tebukti terlibat mafia langsung didegradasi. Pemilu 2024 juga ada mafianya, mulai dari MK, Intevensi Lembaga Negara, bansos, dll...",El-Siver 92,0,0,0,2024-03-05T16:29:46.000Z,"Permainan Sepak Bola juga yang banyak mafianya, seperti di Italia (ada pengaturan skor, keberpihakan wasit karena sudah dibayar). Klub yang tebukti terlibat mafia langsung didegradasi. Pemilu 2024 juga ada mafianya, mulai dari MK, Intevensi Lembaga Negara, bansos, dll..."
banyak masyarakat udah gerah dengan penguasa yang cawe-cawe di pemilu 2024,ebongBoy ,4,1,5,2024-03-05T14:41:22.000Z,banyak masyarakat udah gerah dengan penguasa yang cawe-cawe di pemilu 2024
"Bagaimana cara membuktikan proses kecurangan pada Pemilu?

Ikuti pembahasannya di #BedahEditorial di kanal youtube ""metrotvnews"" https://youtu.be/N09FnmAw49c

#Lonjakan #Suara #PSI #Pemilu2024 #Pilpres2024 #EditorialMalam",METRO TV,2,3,6,2024-03-05T14:02:30.000Z,"Bagaimana cara membuktikan proses kecurangan pada Pemilu?  Ikuti pembahasannya di   di kanal youtube ""metrotvnews""              "
"Massa Aksi Demo Tolak Hasil Pemilu 2024 Bubarkan Diri, Lanjut Lagi 8-10 Maret http://dlvr.it/T3dblR #News",LIPUTAN6,0,21,79,2024-03-05T11:27:35.000Z,"Massa Aksi Demo Tolak Hasil Pemilu 2024 Bubarkan Diri, Lanjut Lagi 8-10 Maret   "
Kata Ketua Bawaslu Periode 2012-2017 soal Potensi Pencurian Suara di Pemilu 2024,KOMPAS TV,1,5,25,2024-03-05T15:33:35.000Z,Kata Ketua Bawaslu Periode 2012-2017 soal Potensi Pencurian Suara di Pemilu 2024
Pemilu 2024 yg menang bangsat2 perusak demokrasi pelanggar konstitusi,Juragan Bansos,0,1,3,2024-03-05T15:28:04.000Z,Pemilu 2024 yg menang bangsat2 perusak demokrasi pelanggar konstitusi
Caleg Petahana Berguguran di Pemilu 2024: Tantangan dan Pembelajaran http://dlvr.it/T3fCsS,Upiq,0,0,0,2024-03-05T15:45:16.000Z,Caleg Petahana Berguguran di Pemilu 2024: Tantangan dan Pembelajaran 
Mari bersama-sama memperkuat persatuan bangsa dan menolak provokasi politik yang ingin memecah belah dalam Pemilu 2024,Aneisha Afla,0,0,0,2024-03-05T18:29:17.000Z,Mari bersama-sama memperkuat persatuan bangsa dan menolak provokasi politik yang ingin memecah belah dalam Pemilu 2024
"PKB,

BOIKOT pemilu 2024 BUKAN angket  !!

#Aktivis 98

bloon",AcoyBK,0,0,0,2024-03-05T13:53:44.000Z,"PKB,  BOIKOT pemilu 2024 BUKAN angket  !!    98  bloon"
semoga yg terlibat dalam KECURANGAN PEMILU 2024 diberi UMUR PANJANG & BURUK AMALnya ......,Pandi Ahmad,0,0,0,2024-03-06T00:47:30.000Z,semoga yg terlibat dalam KECURANGAN PEMILU 2024 diberi UMUR PANJANG & BURUK AMALnya ......
"Info lebih lanjut dapat diakses melalui link atau scan barcode di atas yaaa

#KPUMelayani
#Integritas24jam
#Pemilu2024
#KaPeu
#PemiluSerentak2024
#Pemilu2024Siap
#KamuPeluTau
#KPUKabTrenggalek",KPU Kabupaten Trenggalek,0,0,0,2024-03-05T12:57:03.000Z,Info lebih lanjut dapat diakses melalui link atau scan barcode di atas yaaa                 
"Alhamdulillah
Jalan itu mulai terlihat terang dan semakin baik

DPD sepakat Bentuk Pansus kecurangan pemilu 2024

Tidak ada tempat untuk  kecurangan , bongkar !!!! 

#HakAngket
#DukungHakAngket

https://cnnindonesia.com/nasional/20240305131913-617-1070623/sidang-paripurna-dpd-sepakat-bentuk-pansus-kecurangan-pemilu-2024",Rustam,6,51,124,2024-03-05T12:51:07.000Z,"Alhamdulillah Jalan itu mulai terlihat terang dan semakin baik  DPD sepakat Bentuk Pansus kecurangan pemilu 2024  Tidak ada tempat untuk  kecurangan , bongkar !!!!        "
"DPD RI sepakat untuk bentuk Panitia Khusus (Pansus) dugaan kecurangan Pemilu 2024, nih. 

Simak alasannya kenapa DPD sampai bentuk Pansus, deh. Menurutmu gimana? 

| Narasi Daily",Narasi Newsroom,1,14,65,2024-03-05T16:35:13.000Z,"DPD RI sepakat untuk bentuk Panitia Khusus (Pansus) dugaan kecurangan Pemilu 2024, nih.   Simak alasannya kenapa DPD sampai bentuk Pansus, deh. Menurutmu gimana?   | Narasi Daily"
Website pemilu2024 nya KPU jadi enggak asyik. Terlalu ribet. Mungkin memang disengaja,Roy Romero,0,0,0,2024-03-05T19:23:57.000Z,Website pemilu2024 nya KPU jadi enggak asyik. Terlalu ribet. Mungkin memang disengaja
"""Ada partai yg duduk di parlemen saling berebut mempengaruhi penyelenggara di kecamatan. Belum ada bukti KPU-RI, KPU Provinsi & Kabupaten/Kota melakukan kecurangan. Ada segelintir PPK yg tergoda bermain urusan Pileg.""


@Andiarief__
 Kepala Bappilu DPP 
@PDemokrat
 

#Pemilu2024",Didik Luhur Pambudi,0,6,4,2024-03-05T15:10:25.000Z,"""Ada partai yg duduk di parlemen saling berebut mempengaruhi penyelenggara di kecamatan. Belum ada bukti KPU-RI, KPU Provinsi & Kabupaten/Kota melakukan kecurangan. Ada segelintir PPK yg tergoda bermain urusan Pileg.""      Kepala Bappilu DPP        "
"Sebaliknya di pihak yang MERASA sudah menang versi QC ,juga jangan buta mata,hati dan telinga ketika melihat kebenaran adanya Kecurangan dan kebrutalan rezim mengkondisikan proses pemilu 2024.Memulaiah dlm mengurus negara dg cara2 yg baik,Insya Allah hasilnya juga akan baik.",annanto,0,0,0,2024-03-05T11:07:10.000Z,"Sebaliknya di pihak yang MERASA sudah menang versi QC ,juga jangan buta mata,hati dan telinga ketika melihat kebenaran adanya Kecurangan dan kebrutalan rezim mengkondisikan proses pemilu 2024.Memulaiah dlm mengurus negara dg cara2 yg baik,Insya Allah hasilnya juga akan baik."
"Pasca Pemilu 2024. Babinsa Kodim 1802/Sorong Komsos Dengan Masyarakat.

https://instagram.com/p/C4Jl-D9SOQV/?igsh=MTc2NHY2YWNwYWZlNQ==",KodimSorong,0,0,0,2024-03-05T22:58:10.000Z,Pasca Pemilu 2024. Babinsa Kodim 1802/Sorong Komsos Dengan Masyarakat.  
#Indonesia #Waspada #Konten #Hoax #Hoaks #Pemilu2024 #Politik #Narasi #KontraNarasi #Moderat #NegeriModerat #Informasi #Pancasila #NKRI #TolakIntoleransi #TolakRadikalisme #TolakTerorisme #TolakEkstremisme #SulawesiBarat #Viral #Identitas #Trending #Dunia #Muslim #Toleransi,Sulbar Moderat,0,0,0,2024-03-05T13:54:24.000Z,                                                 
"DCN Global: ""Unraveling Misinformation: Safeguarding Democracy in the 2024 Global Elections""

More: https://youtube.com/live/KTC_NNSE2zI #Elections #IndonesiaElection #Pemilu2024",Aribowo Sasmito,0,1,0,2024-03-05T18:56:28.000Z,"DCN Global: ""Unraveling Misinformation: Safeguarding Democracy in the 2024 Global Elections""  More:       "
Peneliti Indikator Ragukan Soliditas Parpol Pengusung Hak Angket Pemilu 2024 https://beritasatu.com/nasional/2803458/peneliti-indikator-ragukan-soliditas-parpol-pengusung-hak-angket-pemilu-2024?utm_source=dlvr.it&utm_medium=twitter #beritasatu #news #berita,BeritaSatu,0,0,0,2024-03-05T23:06:06.000Z,Peneliti Indikator Ragukan Soliditas Parpol Pengusung Hak Angket Pemilu 2024       
"Tak perlu khawatir, semua pengembalian logistik pemilu 2024 berlangsung aman dan lancar. 
Tentunya dengan pengamanan Intensif dari aparat petugas keamanan setempat. 

FB IG Devina Amel Ganjar Fitra
 Mark Zuckerberg Fitra Eri Heru Budi Ini X",ikram_aja,4,9,9,2024-03-05T23:07:15.000Z,"Tak perlu khawatir, semua pengembalian logistik pemilu 2024 berlangsung aman dan lancar.  Tentunya dengan pengamanan Intensif dari aparat petugas keamanan setempat.   FB IG Devina Amel Ganjar Fitra  Mark Zuckerberg Fitra Eri Heru Budi Ini X"
"Kalaupun mau naik, kenapa hanya salah satu partai? Nah dinamika politik per lima tahun itu di level lapangan ada, tuh, naik turun, salah input angka, itu normal, ujar Sahroni.

#AhmadSahroni #Wakil #Ketua #KomisiIII #DPR #Kejanggalan #Suara #PSI #Pemilu2024",METRO TV,0,0,3,2024-03-05T11:45:06.000Z,"Kalaupun mau naik, kenapa hanya salah satu partai? Nah dinamika politik per lima tahun itu di level lapangan ada, tuh, naik turun, salah input angka, itu normal, ujar Sahroni.                   "
"LUAR BIASA CADASSSS..!

Suara lantang Luluk Nur Hamidah Fraksi PKB Jateng interupsi Sidang Paripurna DPR, dukung Hak Angket

Luluk NH menyebut, pemilu 2024 sebagai pemilu paling BRUTAL yang pernah ia ikuti sejak reformasi 

#DukungHakAngketDPR",𝔹𝕚𝕃𝕃 ℝ𝕒𝕐,11,60,212,2024-03-05T15:30:14.000Z,"LUAR BIASA CADASSSS..!  Suara lantang Luluk Nur Hamidah Fraksi PKB Jateng interupsi Sidang Paripurna DPR, dukung Hak Angket  Luluk NH menyebut, pemilu 2024 sebagai pemilu paling BRUTAL yang pernah ia ikuti sejak reformasi    "
"Putusan Sidang Paripurna, DPD RI Bentuk Pansus Kecurangan Pemilu 2024 https://klikwarta.com/putusan-sidang-paripurna-dpd-ri-bentuk-pansus-kecurangan-pemilu-2024 #News #Berita #Kabar #Popular #klikwarta #InfoMasyarakat #viral #beritaterkini",Klikwarta.com,0,0,0,2024-03-05T13:28:24.000Z,"Putusan Sidang Paripurna, DPD RI Bentuk Pansus Kecurangan Pemilu 2024                 "
"Pemilu 2024, jangan lewatkan kesempatan buat bikin perubahan positif",Anugrah Wiranto,0,0,0,2024-03-05T15:08:00.000Z,"Pemilu 2024, jangan lewatkan kesempatan buat bikin perubahan positif"
"Anggota DPR Fraksi PKS, Aus Hidayat Nur mendorong DPR menggunakan hak angket dalam Pemilu 2024. Hal ini disampaikannya dalam rapat paripurna DPR.",detikcom,3,1,5,2024-03-05T11:14:00.000Z,"Anggota DPR Fraksi PKS, Aus Hidayat Nur mendorong DPR menggunakan hak angket dalam Pemilu 2024. Hal ini disampaikannya dalam rapat paripurna DPR."
Kocakny lembaga survey qodari bilang 82% rakyat puas dg hsl pemilu 2024,the brandal's,0,0,8,2024-03-05T11:21:10.000Z,Kocakny lembaga survey qodari bilang 82% rakyat puas dg hsl pemilu 2024
"Puan dan Cak Imin Tak Hadiri Rapat Paripurna DPR Setelah Pemilu 2024.

seriusan mau Hak angket atau tdk?
Ketua DPR Puan Maharani tdk hadir ,wakil ketua DPR Muhaimin Iskandar juga gak hadir, hanya 164 yg hadir dari 575 anggota dewan. 

Klik untuk baca:",PUTRI CEBONG (IG:Putri_cebong.id),20,21,61,2024-03-05T12:33:52.000Z,"Puan dan Cak Imin Tak Hadiri Rapat Paripurna DPR Setelah Pemilu 2024.  seriusan mau Hak angket atau tdk? Ketua DPR Puan Maharani tdk hadir ,wakil ketua DPR Muhaimin Iskandar juga gak hadir, hanya 164 yg hadir dari 575 anggota dewan.   Klik untuk baca:"
"Bawaslu ikut dalam kecurangan ini,,semoga siapapun yg terlibat dalam kecurangan pemilu 2024 mendapatkan azab yg pedih d dunia dan akhirat,semoga mereka mati menggenaskan dan d segera kan... aamiin",Bakorsi Liko,0,0,0,2024-03-05T15:40:19.000Z,"Bawaslu ikut dalam kecurangan ini,,semoga siapapun yg terlibat dalam kecurangan pemilu 2024 mendapatkan azab yg pedih d dunia dan akhirat,semoga mereka mati menggenaskan dan d segera kan... aamiin"
Kapolres Tapsel Berikan Arahan Penting Dalam Rapat Pleno Rekapitulasi Hasil Pemilu 2024 di Paluta https://klikwarta.com/kapolres-tapsel-berikan-arahan-penting-dalam-rapat-pleno-rekapitulasi-hasil-pemilu-2024-di-paluta #News #Berita #Kabar #Popular #klikwarta #InfoMasyarakat #viral #beritaterkini,Klikwarta.com,0,0,0,2024-03-05T13:52:16.000Z,Kapolres Tapsel Berikan Arahan Penting Dalam Rapat Pleno Rekapitulasi Hasil Pemilu 2024 di Paluta                 
