text,author,reply,retweet,like,date,cleaned_text
Feri Amsari I Aktor Terbesar Kecurangan Pemilu 2024 itu Presiden Jokowi,Mahkamah Keluarga,0,1,2,2024-03-06T01:19:05.000Z,Feri Amsari I Aktor Terbesar Kecurangan Pemilu 2024 itu Presiden Jokowi
"Masyarakat diharapkan untuk bersabar dan menahan diri tidak menyebarkan informasi yang belum diketahui kebenarannya pasca pelaksanaan Pemilu 2024. 

#Pemilu2024
#PemiluDamai2024
#PemiluDamaiNegeriMaju
#Pemilu2024BebasHoaks
#Pemilu2024MenujuIndonesiaMaju",Titah Pandita,0,0,0,2024-03-06T02:38:13.000Z,Masyarakat diharapkan untuk bersabar dan menahan diri tidak menyebarkan informasi yang belum diketahui kebenarannya pasca pelaksanaan Pemilu 2024.            
Patroli dialogis yang humanis unit Samapta Polsek Pancoran Bripka Riki tingkatkan Silaturrahmi sampaikan Pesan Kamtibmas dan Call Center 110 kepada Security Apartemen taman raja untuk menciptakan situasi yg aman dan kondusif usai Pemilu 2024.,Polsek Pancoran,0,0,0,2024-03-06T02:39:01.000Z,Patroli dialogis yang humanis unit Samapta Polsek Pancoran Bripka Riki tingkatkan Silaturrahmi sampaikan Pesan Kamtibmas dan Call Center 110 kepada Security Apartemen taman raja untuk menciptakan situasi yg aman dan kondusif usai Pemilu 2024.
Proses penghitungan suara Pemilu 2024 oleh Komisi Pemilihan Umum (KPU) terus berjalan dan saat ini telah memasuki tahap rekapitulasi hingga 20 Maret 2024 mendatang.,TabloidBintang.com,0,0,0,2024-03-06T02:32:33.000Z,Proses penghitungan suara Pemilu 2024 oleh Komisi Pemilihan Umum (KPU) terus berjalan dan saat ini telah memasuki tahap rekapitulasi hingga 20 Maret 2024 mendatang.
"Blue Light Patrol  Guna Menjaga Kamtibmas Tetap Kondusif serta Terciptanya Kamseltibcar Lantas Pasca Pemilu 2024, Personil Polsek Celukan Bawang Gencar Melaksanakan ""Blue Light Patrol""  #Polresbuleleng #bluelightpatrol #kryd",Humas Polres Buleleng,0,0,0,2024-03-06T02:47:52.000Z,"Blue Light Patrol  Guna Menjaga Kamtibmas Tetap Kondusif serta Terciptanya Kamseltibcar Lantas Pasca Pemilu 2024, Personil Polsek Celukan Bawang Gencar Melaksanakan ""Blue Light Patrol""       "
Ayo bersama ciptakan Pemilu 2024 damai dan aman #PemiluJujur,Gyan,0,0,0,2024-03-06T03:23:58.000Z,Ayo bersama ciptakan Pemilu 2024 damai dan aman  
"Tegakkan kedamaian pasca pemilu tanpa isu negatif dan provokatif.

#Pemilu2024
#PemiluDamai2024
#PemiluDamaiNegeriMaju
#Pemilu2024BebasHoaks
#Pemilu2024MenujuIndonesiaMaju",Titah Pandita,0,0,0,2024-03-06T02:39:11.000Z,Tegakkan kedamaian pasca pemilu tanpa isu negatif dan provokatif.           
"Unit Samapta Polsek Rancaekek Polresta Bandung laksanakan patroli dialogis perintis presisi guna mencegah dan menangkal segala bentuk gangguan kamtibmas di wilayah hukum Polsek Rancaekek pasca dilaksanakannya Pemilu 2024.


@spripim
.polri
@divisihumaspolri",POLSEK RANCAEKEK POLRESTA BANDUNG,0,0,1,2024-03-06T03:16:56.000Z,Unit Samapta Polsek Rancaekek Polresta Bandung laksanakan patroli dialogis perintis presisi guna mencegah dan menangkal segala bentuk gangguan kamtibmas di wilayah hukum Polsek Rancaekek pasca dilaksanakannya Pemilu 2024.     .polri  
"Wadanramil 1802-02/Sorong Barat Monitoring Keamanan Berlangsungnya Rapat Pleno Kota Sorong Pemilu 2024.

https://instagram.com/p/C4KB35Sy7S-/?igsh=MTAxa2UxdTFrbGIyNw==",KodimSorong,0,0,0,2024-03-06T03:08:08.000Z,Wadanramil 1802-02/Sorong Barat Monitoring Keamanan Berlangsungnya Rapat Pleno Kota Sorong Pemilu 2024.  
"Zulfan Lindan Unpacking Indonesia mengundang dua politisi PSI, Irma ""Inang"" Hutabarat dan Andi Budiman, untuk membahas bagaimana perkembangan PSI usai Pemilu 2024.

Link YT : https://youtu.be/qOOkPPDGnTI
Link Spotify : https://open.spotify.com/episode/72I77h3U4awF0G5p0YEB5M?si=2c97786e81c84e83",Unpacking Indonesia,0,0,0,2024-03-06T02:23:56.000Z,"Zulfan Lindan Unpacking Indonesia mengundang dua politisi PSI, Irma ""Inang"" Hutabarat dan Andi Budiman, untuk membahas bagaimana perkembangan PSI usai Pemilu 2024.  Link YT :  Link Spotify : "
"Hormati Hasil Pemilu 2024, Jaga Persatuan Bangsa - Kabarklik
#BeritaTerkini #News #NewsUpdate #KabarKlik",kabarKlik.com,0,0,0,2024-03-06T01:41:22.000Z,"Hormati Hasil Pemilu 2024, Jaga Persatuan Bangsa - Kabarklik        "
"#temanpemilih yuk saksikan Live Streaming Rapat Pleno Terbuka Rekapitulasi dan Penetapan Hasil Penghitungan Perolehan Suara Pemilu 2024 tingkat Provinsi Jawa Tengah, pada Hari Rabu s/d Jumat tanggal 6-8 Maret 2024 pukul 09:00-21:00 WIB.

 Stay Tuned di Youtube KPU Jateng",KPU Purbalingga,0,0,0,2024-03-06T01:48:16.000Z,"  yuk saksikan Live Streaming Rapat Pleno Terbuka Rekapitulasi dan Penetapan Hasil Penghitungan Perolehan Suara Pemilu 2024 tingkat Provinsi Jawa Tengah, pada Hari Rabu s/d Jumat tanggal 6-8 Maret 2024 pukul 09:00-21:00 WIB.   Stay Tuned di Youtube KPU Jateng"
DPD akan membentuk Pansus untuk mengungkap dugaan pelanggaran dan kecurangan pada penyelenggaraan Pemilu 2024.,NETRALNEWS,0,0,0,2024-03-06T03:00:01.000Z,DPD akan membentuk Pansus untuk mengungkap dugaan pelanggaran dan kecurangan pada penyelenggaraan Pemilu 2024.
"Hasil Final KPU Caleg Lolos DAPIL JATIM III DPR RI Pemilu 2024 https://nawacita.co/index.php/2024/03/06/hasil-final-kpu-caleg-lolos-dapil-jatim-iii-dpr-ri-pemilu-2024/ via 
@nawacit4",Nawacita.co,0,0,0,2024-03-06T01:58:15.000Z,Hasil Final KPU Caleg Lolos DAPIL JATIM III DPR RI Pemilu 2024  via   
dpr jdul bang...kami faham...yg hsil pemilu 2024 blom di lantik..pantes aje banyak...lgian banyak yg g kepilih lg mereka ..Kecoa tu,Vivo 1819,0,0,0,2024-03-06T01:13:57.000Z,dpr jdul bang...kami faham...yg hsil pemilu 2024 blom di lantik..pantes aje banyak...lgian banyak yg g kepilih lg mereka ..Kecoa tu
Waspada hoax pasca pemilu 2024.,Claudia,0,0,1,2024-03-06T01:17:29.000Z,Waspada hoax pasca pemilu 2024.
"Melaksanakan Himbauan Kepada pelajar SMA   agar menghidari kenakalan remaja.
#PolresPPU #PoldaKaltim #Polripresisi #Pemilu2024 #PemiluDamai #Damaiindonesia #iknNusa",Sat Binmas Polres Penajam Paser Utara,0,0,0,2024-03-06T02:38:12.000Z,Melaksanakan Himbauan Kepada pelajar SMA   agar menghidari kenakalan remaja.              
"Potret personel Polres bersama anggota Tni dari Koramil 1507-02/Saumlaki laksanakan pengamanan guna antisipasi konsentrasi massa khusus nya dimasa pentahapan Pemilu 2024.

@DivHumas_Polri
 
@Spripim_Polri
 
#divisihumaspolri #spripimpolri #operasimantapbratasalawaku20232024",HUMAS POLRES KEP. TANIMBAR,0,0,1,2024-03-06T02:11:46.000Z,Potret personel Polres bersama anggota Tni dari Koramil 1507-02/Saumlaki laksanakan pengamanan guna antisipasi konsentrasi massa khusus nya dimasa pentahapan Pemilu 2024.               
"PLENO TINGKAT KABUPATEN MAPPI DISTRIK OBAA BERLANGSUNG RICUH , SEJUMLAH FASILITAS DI RUSAKI SEHINGGA PERSONEL KEPOLISIAN BERSAMA TNI DAN BRIMOB LEPASKKAN TEMBAKAN GAS AIR MATA UNTUK MEREHDAHKAN MASSA,

#infokejadianmerauke #infopapua #papuaviral #pemilu2024 #pojokindo",POJOK INDONEWS,0,0,0,2024-03-06T01:00:13.000Z,"PLENO TINGKAT KABUPATEN MAPPI DISTRIK OBAA BERLANGSUNG RICUH , SEJUMLAH FASILITAS DI RUSAKI SEHINGGA PERSONEL KEPOLISIAN BERSAMA TNI DAN BRIMOB LEPASKKAN TEMBAKAN GAS AIR MATA UNTUK MEREHDAHKAN MASSA,           "
"Mari senantiasa menjaga persatuan untuk kesuksesan Pemilu 2024.

#Pemilu2024
#PemiluDamai2024
#PemiluDamaiNegeriMaju
#Pemilu2024BebasHoaks
#Pemilu2024MenujuIndonesiaMaju",Titah Pandita,0,0,0,2024-03-06T02:29:08.000Z,Mari senantiasa menjaga persatuan untuk kesuksesan Pemilu 2024.           
"yg MASIH PADA BUTA.. mau bergelar profesor, akademisi, politisi, buzzerRp sampe buzzer kere!

Silahkan bilang bahwa tidak ada KECURANGAN TSM di pemilu 2024 ini..!

Mudah2an Allah benar2 MEMBUTAKAN MATA HATI kalian semua..!",boetix,0,0,0,2024-03-06T02:31:29.000Z,"yg MASIH PADA BUTA.. mau bergelar profesor, akademisi, politisi, buzzerRp sampe buzzer kere!  Silahkan bilang bahwa tidak ada KECURANGAN TSM di pemilu 2024 ini..!  Mudah2an Allah benar2 MEMBUTAKAN MATA HATI kalian semua..!"
Daftar : https://s.id/freelancejobs.. #Pemilu2024 #HappyValentine #27thValentineWithJaehyun #PDIP #hebatbet #cs1hebatbet #SMTOWN2024 #Tobeli #___,CS1Hebatbet,0,0,0,2024-03-06T00:58:52.000Z,Daftar :                   
Jangan biarkan penundaan pemilu 2024 mengganggu proses demokrasi dan stabilitas negara. #PemiluJujur,Titin,0,0,0,2024-03-06T03:23:58.000Z,Jangan biarkan penundaan pemilu 2024 mengganggu proses demokrasi dan stabilitas negara.  
MasyaAllah ... Kejahatan Pemilu 2024 hrs di bongkar nih.,Mohammad Khafid Khafid,0,3,3,2024-03-06T03:09:20.000Z,MasyaAllah ... Kejahatan Pemilu 2024 hrs di bongkar nih.
"Walau ngga bisa dipercaya, tetapi informasi suara hasil pemilu 2024 zong di web KPU http://pemilu2024.kpu.go.id ...",Pray4Gaza&FightZio,0,0,0,2024-03-06T01:03:06.000Z,"Walau ngga bisa dipercaya, tetapi informasi suara hasil pemilu 2024 zong di web KPU  ..."
FKUB Yapen Ajak Masyarakat Tetap Jaga Kebersamaan usai Pemilu 2024,inbrek.com,0,0,0,2024-03-06T03:17:06.000Z,FKUB Yapen Ajak Masyarakat Tetap Jaga Kebersamaan usai Pemilu 2024
"Selama masih mengulur2 waktu buat cabut dari kabinetnya Jokowi, ini jelas cuma gertakan dan lucu2an.
Hak angket ga bisa buat gugat pelaksanaan pemilu 2024 dan hasilnya, tp bisa buat melengserkan presiden. Jd sebaiknya keluar dulu dari kabinet. Baru ajukan hak angket, lbh fair.",Pajak Karbon 2025,0,0,0,2024-03-06T03:24:10.000Z,"Selama masih mengulur2 waktu buat cabut dari kabinetnya Jokowi, ini jelas cuma gertakan dan lucu2an. Hak angket ga bisa buat gugat pelaksanaan pemilu 2024 dan hasilnya, tp bisa buat melengserkan presiden. Jd sebaiknya keluar dulu dari kabinet. Baru ajukan hak angket, lbh fair."
"Pasca Pemilu 2024, suara kritis terhadap penyelenggara pemilu, proses yang diduga penuh dengan kecurangan dan 'cawe-cawe' presiden, serta rekapitulasi suara yang mencurigakan, masih marak mengisi ruang publik dan pemberitaan di Indonesia.",Suara Kebebasan,1,1,1,2024-03-06T02:48:37.000Z,"Pasca Pemilu 2024, suara kritis terhadap penyelenggara pemilu, proses yang diduga penuh dengan kecurangan dan 'cawe-cawe' presiden, serta rekapitulasi suara yang mencurigakan, masih marak mengisi ruang publik dan pemberitaan di Indonesia."
PKS Sebut Pilkada akan Lebih Kacau jika Dugaan Kecurangan Pemilu 2024 Dibiarkan http://dlvr.it/T3gQKy #News,LIPUTAN6,1,2,9,2024-03-06T02:47:06.000Z,PKS Sebut Pilkada akan Lebih Kacau jika Dugaan Kecurangan Pemilu 2024 Dibiarkan   
"'Kalian akan Rakus terhadap Jabatan, padahal jabatan itu akan menjadi Penyesalan di hari Kiamat, ia adalah seenak-enak penyusuan dan segetir-getir penyapihan' (Bukhori 6615)

Lbh menyesal lg bila jabatan didapatkan dgn cara yg tdk benar dan baik, berat Hisabnya.
Pemilu 2024 MKMK",RakyatKeciL,0,0,0,2024-03-06T02:47:44.000Z,"'Kalian akan Rakus terhadap Jabatan, padahal jabatan itu akan menjadi Penyesalan di hari Kiamat, ia adalah seenak-enak penyusuan dan segetir-getir penyapihan' (Bukhori 6615)  Lbh menyesal lg bila jabatan didapatkan dgn cara yg tdk benar dan baik, berat Hisabnya. Pemilu 2024 MKMK"
KPU dan Bawaslu membutuhkan dukungan kita untuk menjamin Pemilu 2024 berjalan dengan baik dan lancar. #PemiluJujur,ikarubiasy,0,0,0,2024-03-06T03:01:07.000Z,KPU dan Bawaslu membutuhkan dukungan kita untuk menjamin Pemilu 2024 berjalan dengan baik dan lancar.  
Apel Pengamanan Kotak Suara Dan Logistik Pemilu 2024 Di Kemantren Kraton,Koramil_kotagede,0,0,0,2024-03-06T03:23:55.000Z,Apel Pengamanan Kotak Suara Dan Logistik Pemilu 2024 Di Kemantren Kraton
Komitmen TNI-Polri Jamin Keamanan dan Kelancaran Pemilu 2024,Polsek Air Besi,0,0,0,2024-03-06T01:52:46.000Z,Komitmen TNI-Polri Jamin Keamanan dan Kelancaran Pemilu 2024
"Indonesia baru saja melaksanakan pesta demokrasi 5 tahunan yang diselenggarakan secara serentak. Meski belum diketahui pemenang dalam Pemilihan Umum (Pemilu) 2024, perpindahan pemerintahan sudah dipastikan akan terjadi di tahun ini.
Selengkapnya",The Iconomicsᅠᅠᅠᅠᅠᅠᅠᅠᅠᅠᅠᅠᅠᅠᅠᅠᅠᅠᅠᅠᅠᅠᅠᅠᅠᅠᅠᅠᅠᅠ,0,0,0,2024-03-06T03:16:34.000Z,"Indonesia baru saja melaksanakan pesta demokrasi 5 tahunan yang diselenggarakan secara serentak. Meski belum diketahui pemenang dalam Pemilihan Umum (Pemilu) 2024, perpindahan pemerintahan sudah dipastikan akan terjadi di tahun ini. Selengkapnya"
"Ganjar Dilaporkan ke KPK saat Panasnya Pengajuan Hak Angket Kecurangan Pemilu, TPN: Gerakan Politik. Selengkapnya>> https://bitly.ws/3f4Kt

#ganjar #kpk #hakangket #pemilu2024 #pilpres2024 #beritaterkini",Tribun Video,0,0,0,2024-03-06T01:14:14.000Z,"Ganjar Dilaporkan ke KPK saat Panasnya Pengajuan Hak Angket Kecurangan Pemilu, TPN: Gerakan Politik. Selengkapnya>>              "
"#temanpemilih #repost 
@KPU_Jateng
 
saksikan Live Streaming Rapat Pleno Terbuka Rekapitulasi dan Penetapan Hasil Penghitungan Perolehan Suara Pemilu 2024 tingkat Provinsi Jawa Tengah, Hari Rabu s/d Jumat tanggal 6-8 Maret 2024 pukul 09:00-21:00 WIB
Di channel Youtube KPU Jateng",PPK SUSUKAN,0,0,0,2024-03-06T02:01:41.000Z,"         saksikan Live Streaming Rapat Pleno Terbuka Rekapitulasi dan Penetapan Hasil Penghitungan Perolehan Suara Pemilu 2024 tingkat Provinsi Jawa Tengah, Hari Rabu s/d Jumat tanggal 6-8 Maret 2024 pukul 09:00-21:00 WIB Di channel Youtube KPU Jateng"
"Dugaan kecurangan yang terjadi di Pemilu 2024 merupakan masalah serius yang harus ditindaklanjuti. Tak cukup, pelanggaran pemilu hanya dibawa ke MK. Perlu tindakan politik untuk menyelidiki dugaan kecurangan itu. Salah satunya, lewat hak angket di DPR.

https://rm.id/baca-berita/pemilu/212688/andreas-hugo-pareira-di-podcast-ngegas-rm-pemilu-2024-banyak-kejanggalan",Rakyat Merdeka,0,0,0,2024-03-06T02:00:01.000Z,"Dugaan kecurangan yang terjadi di Pemilu 2024 merupakan masalah serius yang harus ditindaklanjuti. Tak cukup, pelanggaran pemilu hanya dibawa ke MK. Perlu tindakan politik untuk menyelidiki dugaan kecurangan itu. Salah satunya, lewat hak angket di DPR.  "
"Kegiatan Patroli Dialogis Polsek Sungai Kakap, Memberikan Himbauan Kambtibmas dan Mengajak Masyarakat bersama Sama menjaga situasi Kamtibmas yang Kondusif Pasca Pemilu 2024 (06/03).",Polsek Sungai Kakap,0,0,0,2024-03-06T03:10:05.000Z,"Kegiatan Patroli Dialogis Polsek Sungai Kakap, Memberikan Himbauan Kambtibmas dan Mengajak Masyarakat bersama Sama menjaga situasi Kamtibmas yang Kondusif Pasca Pemilu 2024 (06/03)."
"Ini sdh mulai seperti Yusril yg mensiasati hukum,mestinya si paman Usman itu dipecat jadi hakim MK shg mati langkah tuh Mukidi dlm pemilu 2024",Daeng,0,0,3,2024-03-06T02:31:57.000Z,"Ini sdh mulai seperti Yusril yg mensiasati hukum,mestinya si paman Usman itu dipecat jadi hakim MK shg mati langkah tuh Mukidi dlm pemilu 2024"
"Personil Piket Bhabinkamtibmas Polsek Rancaekek Polresta Bandung laksanakan patroli dialogis perintis presisi guna mencegah dan menangkal segala bentuk gangguan kamtibmas di wilayah hukum Polsek Rancaekek pasca dilaksanakannya Pemilu 2024.


@spripim
.polri
@divisihumaspolri",POLSEK RANCAEKEK POLRESTA BANDUNG,0,0,1,2024-03-06T03:17:44.000Z,Personil Piket Bhabinkamtibmas Polsek Rancaekek Polresta Bandung laksanakan patroli dialogis perintis presisi guna mencegah dan menangkal segala bentuk gangguan kamtibmas di wilayah hukum Polsek Rancaekek pasca dilaksanakannya Pemilu 2024.     .polri  
"Repost 
@kpujateng


#temanpemilih yuk saksikan Live Streaming Rapat Pleno Terbuka Rekapitulasi dan Penetapan Hasil Penghitungan Perolehan Suara Pemilu 2024 tingkat Provinsi Jawa Tengah

 Stay Tuned di Youtube KPU Jateng

#kpumelayani #pemiluserentak2024",PPK Banyuurip,0,0,1,2024-03-06T01:16:46.000Z,Repost        yuk saksikan Live Streaming Rapat Pleno Terbuka Rekapitulasi dan Penetapan Hasil Penghitungan Perolehan Suara Pemilu 2024 tingkat Provinsi Jawa Tengah   Stay Tuned di Youtube KPU Jateng     
Jayapura  Saat ini di salah satu hotel di Kota Jayapura sedang diadakan Pleno Rekapitusi Suara Pemilu 2024 tingkat Provinsi.,Hmspoldapapua,0,0,0,2024-03-06T02:46:13.000Z,Jayapura  Saat ini di salah satu hotel di Kota Jayapura sedang diadakan Pleno Rekapitusi Suara Pemilu 2024 tingkat Provinsi.
Tidak ada alasan untuk menunda pemilu 2024. Mari jaga proses demokrasi yang sehat dan stabil.,jeson rockwell,0,0,0,2024-03-06T03:17:14.000Z,Tidak ada alasan untuk menunda pemilu 2024. Mari jaga proses demokrasi yang sehat dan stabil.
"Kapolres Bengkulu Utara AKBP Lambe Patabang Birana S.I.K., M.H., mengucapkan terima kasih kepada personel Polres Bengkulu Utara atas dedikasinya menjaga Kondifitas, keamanan dan pelaksanaan rangkaian Pemilu 2024 sehingga berjalan aman dan terkendali",Polsek Air Besi,0,0,0,2024-03-06T02:21:31.000Z,"Kapolres Bengkulu Utara AKBP Lambe Patabang Birana S.I.K., M.H., mengucapkan terima kasih kepada personel Polres Bengkulu Utara atas dedikasinya menjaga Kondifitas, keamanan dan pelaksanaan rangkaian Pemilu 2024 sehingga berjalan aman dan terkendali"
"Wakil Ketua Komisi VI DPR RI Fraksi PDI Perjuangan (PDIP) Aria Bima menyatakan agenda besar hak angket yang diusulkan pihaknya bukan untuk mengagalkan hasil Pemilu 2024 dan pemakzulan Presiden Joko Widodo.

Aria Bima menjelaskan, yang ingin disasar dalam agenda besar itu,",inilahcom,1,0,0,2024-03-06T02:13:38.000Z,"Wakil Ketua Komisi VI DPR RI Fraksi PDI Perjuangan (PDIP) Aria Bima menyatakan agenda besar hak angket yang diusulkan pihaknya bukan untuk mengagalkan hasil Pemilu 2024 dan pemakzulan Presiden Joko Widodo.  Aria Bima menjelaskan, yang ingin disasar dalam agenda besar itu,"
"Mari senantiasa jaga kerukunan kita menjelang akhir pemilu demi bangsa yang bermartabat.

#Pemilu2024BebasHoaks
#Pemilu2024
#PemiluDamai2024
#Pemilu2024MenujuIndonesiaMaju
#PemiluDamaiNegeriMaju",Titah Pandita,0,0,0,2024-03-06T02:15:11.000Z,Mari senantiasa jaga kerukunan kita menjelang akhir pemilu demi bangsa yang bermartabat.           
"Kecurangan pemilu 2024 di berbagai daerah menggembosi suara paslon 01 dan memainkan suara partai pendukung perubahan AMIN
#DukungHakAngketDPR 

SEGERA MAKZULKAN JOKOWI DALAM TEMPO YANG SESINGKAT SINGKATNYA

HUKUM MATI JOKOWI,KETUA KPU,KETUA BAWASLU&PENYELENGGARA PEMILU CURANG",Akunketigabelas Bjodoh,0,1,3,2024-03-06T02:22:11.000Z,"Kecurangan pemilu 2024 di berbagai daerah menggembosi suara paslon 01 dan memainkan suara partai pendukung perubahan AMIN     SEGERA MAKZULKAN JOKOWI DALAM TEMPO YANG SESINGKAT SINGKATNYA  HUKUM MATI JOKOWI,KETUA KPU,KETUA BAWASLU&PENYELENGGARA PEMILU CURANG"
Transparansi Pemilu 2024 gagal total.....saatnya para caleg saling sodok dalam gelap......semakin gelap semakin yahud bagi tangan2 kotor,Diro Noto,0,0,0,2024-03-06T01:40:24.000Z,Transparansi Pemilu 2024 gagal total.....saatnya para caleg saling sodok dalam gelap......semakin gelap semakin yahud bagi tangan2 kotor
Patroli dialogis yang humanis unit Samapta Polsek Pancoran Aiptu Supriadi bersama tiga pilar tingkatkan Silaturrahmi sampaikan Pesan Kamtibmas dan Call Center 110 kepada warga untuk menciptakan situasi yg aman dan kondusif usai Pemilu 2024.,Polsek Pancoran,0,0,0,2024-03-06T02:45:02.000Z,Patroli dialogis yang humanis unit Samapta Polsek Pancoran Aiptu Supriadi bersama tiga pilar tingkatkan Silaturrahmi sampaikan Pesan Kamtibmas dan Call Center 110 kepada warga untuk menciptakan situasi yg aman dan kondusif usai Pemilu 2024.
Kita semua memiliki tanggung jawab untuk memastikan Pemilu 2024 berjalan sesuai jadwal dan berjalan dengan lancar. #PemiluI,Enriko Praya,0,0,0,2024-03-06T03:00:50.000Z,Kita semua memiliki tanggung jawab untuk memastikan Pemilu 2024 berjalan sesuai jadwal dan berjalan dengan lancar.  
Pemilu 2024 bukti nyata kemunduran demokrasi,kangbph,0,0,0,2024-03-06T00:59:08.000Z,Pemilu 2024 bukti nyata kemunduran demokrasi
"Pakar Komunikasi Politik, Effendi Gazali menyinggung intimidasi dalam penyelenggaraan Pemilu 2024. Ia mengibaratkan pemilu Indonesia ertentangan dengan kode etik 'FIFA' no 24 dan no 26 tentang Intimidasi dan Eksploitasi.

#EffendiGazali #kodeetik #FIFA #pemilu2024",iNews,0,1,0,2024-03-06T01:38:12.000Z,"Pakar Komunikasi Politik, Effendi Gazali menyinggung intimidasi dalam penyelenggaraan Pemilu 2024. Ia mengibaratkan pemilu Indonesia ertentangan dengan kode etik 'FIFA' no 24 dan no 26 tentang Intimidasi dan Eksploitasi.         "
"MUI Serahkan Urusan Hak Angket Pemilu 2024 ke Para Politikus di Senayan
 
https://m.tribunnews.com/mata-lokal-memilih/2024/03/06/mui-serahkan-urusan-hak-angket-pemilu-2024-ke-para-politikus-di-senayan via 
@tribunnews",Mahlina,0,0,0,2024-03-06T03:16:04.000Z,MUI Serahkan Urusan Hak Angket Pemilu 2024 ke Para Politikus di Senayan    via   
Patroli dialogis yang humanis unit Binmas Polsek Pancoran Aiptu Nur Cholis tingkatkan Silaturrahmi sampaikan Pesan Kamtibmas dan Call Center 110 kepada Security  untuk menciptakan situasi yg aman dan kondusif usai Pemilu 2024.,Polsek Pancoran,0,0,0,2024-03-06T02:49:16.000Z,Patroli dialogis yang humanis unit Binmas Polsek Pancoran Aiptu Nur Cholis tingkatkan Silaturrahmi sampaikan Pesan Kamtibmas dan Call Center 110 kepada Security  untuk menciptakan situasi yg aman dan kondusif usai Pemilu 2024.
"Peningkatan partisipasi pemilih juga dibarengi dengan berjalannya pelaksanaan Pemilu 2024 di Kabupaten Serang yang lancar, aman, dan damai.",mraldy,1,0,0,2024-03-06T02:32:28.000Z,"Peningkatan partisipasi pemilih juga dibarengi dengan berjalannya pelaksanaan Pemilu 2024 di Kabupaten Serang yang lancar, aman, dan damai."
"Jawab Kecurigaan Publik Soal Kecurangan Pemilu 2024, Legislator PKS Dorong Hak Angket http://dlvr.it/T3gRzB PKS Pembela Rakyat",PKS Sukakarya,0,0,0,2024-03-06T03:08:10.000Z,"Jawab Kecurigaan Publik Soal Kecurangan Pemilu 2024, Legislator PKS Dorong Hak Angket  PKS Pembela Rakyat"
"Melelahkan : sudah tua ikut 5 x pilpres
Kacau : protes hasil pemilu 2019 sampai dengan korban jiwa. Pemilu 2024 juga rusak sejak pangeran masuk lewat jalur MK
Sangat Mahal : bisnis macet karena tidak berkuasa, gadai tanah sana sini untuk biaya kampanye. 

#tiktok",New Sandy SJ,0,0,1,2024-03-06T03:23:09.000Z,"Melelahkan : sudah tua ikut 5 x pilpres Kacau : protes hasil pemilu 2019 sampai dengan korban jiwa. Pemilu 2024 juga rusak sejak pangeran masuk lewat jalur MK Sangat Mahal : bisnis macet karena tidak berkuasa, gadai tanah sana sini untuk biaya kampanye.    "
"Yg anda jelaskan itu mrpk bagian dari keseluruhan kecurangan pemilu 2024 ini. Kecurangan2 lain msh ada, & anda jgn menutup mata, hanya karena partai anda sdh dpt jatah menteri.",JarnoTruly,0,0,0,2024-03-06T01:58:54.000Z,"Yg anda jelaskan itu mrpk bagian dari keseluruhan kecurangan pemilu 2024 ini. Kecurangan2 lain msh ada, & anda jgn menutup mata, hanya karena partai anda sdh dpt jatah menteri."
"Hoaks merupakan salah satu ancaman yang dapat mengganggu jalannya masa rekapitulasi suara dalam Pemilu 2024.

#Pemilu2024
#PemiluDamai2024
#PemiluDamaiNegeriMaju
#Pemilu2024BebasHoaks
#Pemilu2024MenujuIndonesiaMaju",Titah Pandita,0,0,0,2024-03-06T02:31:34.000Z,Hoaks merupakan salah satu ancaman yang dapat mengganggu jalannya masa rekapitulasi suara dalam Pemilu 2024.           
"DPD RI Sepakat bentuk 
PANSUS 
Kecurangan Pemilu 2024

#DukungHakAngketDPR",Qiunco2761Reaborn,0,1,2,2024-03-06T02:28:46.000Z,DPD RI Sepakat bentuk  PANSUS  Kecurangan Pemilu 2024   
"Jangan Saling Mencaci Dan Membuat Sesuatu Yang Dapat Memecah Belah Bangsa Termasuk Di Dunia Maya Ya Sobat Polri!

#PolriHumanis #PolriPresisi #omb2024 #mantapbrata2024 #pemilu2024 #pemiludamai2024
#Polda NTT#Polres Ngada @listyosigitprabowo

@spripim
.polri@divisihumaspolri",Kasi Humas Polres Ngada,0,0,1,2024-03-06T02:00:47.000Z,Jangan Saling Mencaci Dan Membuat Sesuatu Yang Dapat Memecah Belah Bangsa Termasuk Di Dunia Maya Ya Sobat Polri!                NTT  Ngada      .polri 
Mengapa Luluk Nur Hamidah (PKB) menyatakan kalau Pemilu 2024 Brutal,Ridwan Roy T,0,0,0,2024-03-06T01:14:41.000Z,Mengapa Luluk Nur Hamidah (PKB) menyatakan kalau Pemilu 2024 Brutal
"NasDem Gerak Cepat Kumpulkan Tanda Tangan Anggota DPR untuk Gulirkan Hak Angket Kecurangan Pemilu 2024
 http://kontenislam.com/2024/03/nasdem-gerak-cepat-kumpulkan-tanda.html",kontenislamcom,0,0,0,2024-03-06T01:39:20.000Z,NasDem Gerak Cepat Kumpulkan Tanda Tangan Anggota DPR untuk Gulirkan Hak Angket Kecurangan Pemilu 2024  
"Top News 3: Partai NasDem tak ikut menyuarakan usulan pengguliran hak angket DPR berkaitan dengan dugaan kecurangan Pemilu 2024. Apa alasannya?

Selengkapnya: Nasdem Tak Ikut Usulkan Hak Angket di Rapat Paripurna, Ini Alasannya

https://katadata.co.id/berita/nasional/65e6d539130c9/nasdem-tak-ikut-usulkan-hak-angket-di-rapat-paripurna-ini-alasannya #NasDem #HakAngket",Katadata.co.id,1,0,0,2024-03-06T02:13:28.000Z,"Top News 3: Partai NasDem tak ikut menyuarakan usulan pengguliran hak angket DPR berkaitan dengan dugaan kecurangan Pemilu 2024. Apa alasannya?  Selengkapnya: Nasdem Tak Ikut Usulkan Hak Angket di Rapat Paripurna, Ini Alasannya      "
"#TemanPemilih Berikut Pengumuman NO: 217/PL.01.8-Pu/1110/2024 tentang Rekapitulasi Hasil Penghitungan Perolehan Suara Pemilu Presiden & Wakil Presiden, (DPR), (DPD), (DPRD) Provinsi, & (DPRD) Kab Dalam Pemilu 2024 Aceh Singkil

https://s.id/PengumumanRekapitulasiAcehSingkil

#PemiluSerentak2024",KIP Kabupaten Aceh Singkil,0,0,1,2024-03-06T02:23:59.000Z,"  Berikut Pengumuman NO: 217/PL.01.8-Pu/1110/2024 tentang Rekapitulasi Hasil Penghitungan Perolehan Suara Pemilu Presiden & Wakil Presiden, (DPR), (DPD), (DPRD) Provinsi, & (DPRD) Kab Dalam Pemilu 2024 Aceh Singkil     "
"Saat itu pemilu transparan,adil dan jujur. Ga ada cawe2 tuh. Pemilu 2024 tidak sama.",Brilian Ali,0,0,0,2024-03-06T03:02:12.000Z,"Saat itu pemilu transparan,adil dan jujur. Ga ada cawe2 tuh. Pemilu 2024 tidak sama."
"Bukan aku yg ngerasain imbasnya, tpi sekitarku. Ini sblm ada pemilu 2024, jadi ngga heran sama pilihan mereka pas pemilu ini",Fifi,0,0,0,2024-03-06T02:29:00.000Z,"Bukan aku yg ngerasain imbasnya, tpi sekitarku. Ini sblm ada pemilu 2024, jadi ngga heran sama pilihan mereka pas pemilu ini"
