text,author,reply,retweet,like,date,cleaned_text
Tingkat Partisipasi Warga Jawa Timur di Pemilu 2024 Capai 83 Persen https://beritasatu.com/bersatu-kawal-pemilu/2803435/tingkat-partisipasi-warga-jawa-timur-di-pemilu-2024-capai-83-persen?utm_source=dlvr.it&utm_medium=twitter #beritasatu #news #berita,BeritaSatu,0,0,2,2024-03-05T17:26:14.000Z,Tingkat Partisipasi Warga Jawa Timur di Pemilu 2024 Capai 83 Persen       
"Komposisi Kursi DPRD Kabupaten Pasuruan Berdasarkan Rekapitulasi Perolehan Suara Pemilu 2024 ! yuk, Baca Selengkapnya hanya di:
https://dialogmasa.com/komposisi-kursi-dprd-kabupaten-pasuruan-berdasarkan-rekapitulasi-perolehan-suara-pemilu-2024/

#MYHUSBAND #RestinPeace #Taliban #Nasdem #MARKLEE #Exhuma #7llin #KJMU #baekhyun #RedVelvet #SEVENTEEN #Sore #Ginting #Sanggup",Dialogmasa,5,0,1,2024-03-05T12:50:02.000Z,"Komposisi Kursi DPRD Kabupaten Pasuruan Berdasarkan Rekapitulasi Perolehan Suara Pemilu 2024 ! yuk, Baca Selengkapnya hanya di:                              "
"Tahapan perhitungam suara Pemilu 2024 sedang berlangsung. Mari kita jaga persatuan dan kesatuan dengan tidak mudah terprovokasi pemberitaan negatif. Sehingga proses perhitungan suara dapat berlangsung kondusif. 
#Pemilu2024AmanDamai
#SukseskanPemilu2024
#wujudkanpemiludamai",Bela NKRI,0,0,1,2024-03-05T11:18:56.000Z,Tahapan perhitungam suara Pemilu 2024 sedang berlangsung. Mari kita jaga persatuan dan kesatuan dengan tidak mudah terprovokasi pemberitaan negatif. Sehingga proses perhitungan suara dapat berlangsung kondusif.       
Mayoritas rakyat Indonesia menginginkan Hak Angket dilaksanakan oleh DPR utk selidiki kecurangan Pemilu 2024.,Venus1970,0,0,1,2024-03-05T13:31:27.000Z,Mayoritas rakyat Indonesia menginginkan Hak Angket dilaksanakan oleh DPR utk selidiki kecurangan Pemilu 2024.
"Dewan Perwakilan Daerah (DPD) RI telah sepakat membentuk panitia khusus (pansus) kecurangan Pemilu 2024. Keputusan disepakati dalam Rapat Paripurna DPD RI ke 9 Masa Sidang IV di Gedung DPD RI, Senayan, Jakarta, Selasa (5/3/2024).",riak,0,0,0,2024-03-05T12:14:14.000Z,"Dewan Perwakilan Daerah (DPD) RI telah sepakat membentuk panitia khusus (pansus) kecurangan Pemilu 2024. Keputusan disepakati dalam Rapat Paripurna DPD RI ke 9 Masa Sidang IV di Gedung DPD RI, Senayan, Jakarta, Selasa (5/3/2024)."
Tampilan web pemilu 2024 ada yg berubah,Syamsudin Jaya,0,0,0,2024-03-05T23:37:06.000Z,Tampilan web pemilu 2024 ada yg berubah
"Periksa Kecurangan, DPD Akan Bentuk Pansus Pemilu 2024",Bloomberg Technoz,0,0,0,2024-03-05T11:34:06.000Z,"Periksa Kecurangan, DPD Akan Bentuk Pansus Pemilu 2024"
DPD RI Bentuk Pansus Pemilu 2024 http://dlvr.it/T3ft2g,penakunews,0,0,0,2024-03-05T20:41:20.000Z,DPD RI Bentuk Pansus Pemilu 2024 
"Gen Z, jangan lupa daftar dan nyoblos di pemilu 2024, ya",Muamar Sofyan,0,0,0,2024-03-05T21:06:39.000Z,"Gen Z, jangan lupa daftar dan nyoblos di pemilu 2024, ya"
Sudah Terang Benderang ya Cawe-Cawe si Mukidi Dalam Pilpres Pemilu 2024 ini.,Hasian,0,0,0,2024-03-05T17:04:19.000Z,Sudah Terang Benderang ya Cawe-Cawe si Mukidi Dalam Pilpres Pemilu 2024 ini.
SEPERTI MEMANCING NYALI PDIP MEGAPUAN UNTUK MENGGALANG HAK ANGKET DPR TENTANG KECURANGAN PEMILU 2024.,makroepoon,0,0,0,2024-03-05T11:14:04.000Z,SEPERTI MEMANCING NYALI PDIP MEGAPUAN UNTUK MENGGALANG HAK ANGKET DPR TENTANG KECURANGAN PEMILU 2024.
Semoga Hak Angket Nanti Sukses Membongkar Kecurangan KPU dan si Mukidi di Pilpres Pemilu 2024 Demi Mau Memenangkan Paslon 02 dan Hak Angket Sudah Resmi Diajukan di DPR pada Hari ini Selasa (05/03/2024).  ,Hasian,0,0,0,2024-03-05T17:16:52.000Z,Semoga Hak Angket Nanti Sukses Membongkar Kecurangan KPU dan si Mukidi di Pilpres Pemilu 2024 Demi Mau Memenangkan Paslon 02 dan Hak Angket Sudah Resmi Diajukan di DPR pada Hari ini Selasa (05/03/2024).  
Gerindra: Rakyat Butuh Lapangan Kerja Bukan Hak Angket Pemilu 2024 https://beritasatu.com/nasional/2803433/gerindra-rakyat-butuh-lapangan-kerja-bukan-hak-angket-pemilu-2024?utm_source=dlvr.it&utm_medium=twitter #beritasatu #news #berita,BeritaSatu,1,0,3,2024-03-06T00:09:08.000Z,Gerindra: Rakyat Butuh Lapangan Kerja Bukan Hak Angket Pemilu 2024       
"Wujudkan pemilu damai

#Pemilu2024
#PemiluDamai2024",Schatzli Cuizon,0,0,0,2024-03-06T00:36:05.000Z,Wujudkan pemilu damai     
"Aksi Desak DPR Gunakan Hak Angket Usut Dugaan Pemilu 2024 Curang, Ini Tuntutan Mereka https://nasional.tempo.co/read/1841352/aksi-desak-dpr-gunakan-hak-angket-usut-dugaan-pemilu-2024-curang-ini-tuntutan-mereka?utm_source=Twitter&utm_medium=dlvr.it #TempoNasional",tempo.co,0,0,9,2024-03-05T14:01:38.000Z,"Aksi Desak DPR Gunakan Hak Angket Usut Dugaan Pemilu 2024 Curang, Ini Tuntutan Mereka   "
Apa merubah UU di MK sblm pemilu itu artinya tidak gentlemen pak? Logika nya gak adil nih profesor. Hrsnya kan silahkan smua dipersilahkan mengambil hak hukum. Kl logic nya ikut prof artinya Prabowo Gibran dan Jokowi dan MK TDK gentle menghadapi pemilu 2024 dgn merubah aturan,Griya Kule,0,0,1,2024-03-05T23:27:31.000Z,Apa merubah UU di MK sblm pemilu itu artinya tidak gentlemen pak? Logika nya gak adil nih profesor. Hrsnya kan silahkan smua dipersilahkan mengambil hak hukum. Kl logic nya ikut prof artinya Prabowo Gibran dan Jokowi dan MK TDK gentle menghadapi pemilu 2024 dgn merubah aturan
"Suara Golkar Melonjak di Pemilu 2024, Pengamat Sayangkan Jika Tak Dapat Kursi Dapil Jakarta 1 http://dlvr.it/T3dnY9 #News",LIPUTAN6,0,0,1,2024-03-05T12:51:34.000Z,"Suara Golkar Melonjak di Pemilu 2024, Pengamat Sayangkan Jika Tak Dapat Kursi Dapil Jakarta 1   "
"Effendi Gazali: Pemilu 2024 Langgar Kode Etik 'FIFA' https://youtube.com/shorts/t7jQC4auMX4?si=AY1n-QjB-EV2xiwc via 
@YouTube",TbH Mulyono,0,0,0,2024-03-05T19:11:51.000Z,Effendi Gazali: Pemilu 2024 Langgar Kode Etik 'FIFA'  via   
"Setelah Pemilu 2024, Indonesia mempertahankan suasana kondusif.

#Pemilu2024BebasHoaks
#Pemilu2024
#PemiluDamai2024
#Pemilu2024MenujuIndonesiaMaju
#PemiluDamaiNegeriMaju",Qory Amalia,0,1,1,2024-03-05T11:29:43.000Z,"Setelah Pemilu 2024, Indonesia mempertahankan suasana kondusif.           "
"Isu Hak Angket Bergulir, PKS-PKB-PDIP Interupsi Paripurna

SATELITNEWS, JAKARTABola panas hak angket terkait dugaan kecurangan Pemilu 2024 mulai dilempar di Senayan. Sejumlah anggota DPR mengusulkannya dalam rapat paripurna ke-13 pembukaan masa sidang I",Satelit News,0,0,0,2024-03-05T11:22:30.000Z,"Isu Hak Angket Bergulir, PKS-PKB-PDIP Interupsi Paripurna  SATELITNEWS, JAKARTABola panas hak angket terkait dugaan kecurangan Pemilu 2024 mulai dilempar di Senayan. Sejumlah anggota DPR mengusulkannya dalam rapat paripurna ke-13 pembukaan masa sidang I"
Ketua DPP Partai NasDem Taufik Basari memastikan semua legislator NasDem akan setuju soal hak angket dugaan kecurangan Pemilu 2024.,suaradotcom,1,3,4,2024-03-05T13:32:04.000Z,Ketua DPP Partai NasDem Taufik Basari memastikan semua legislator NasDem akan setuju soal hak angket dugaan kecurangan Pemilu 2024.
"Semoga prosesnya bisa lebih cepat dan menghasilkan putusan kecurangan pemilu 2024
.
Wakil rakyat harus merakyat.",DJTech,0,0,0,2024-03-05T23:28:32.000Z,Semoga prosesnya bisa lebih cepat dan menghasilkan putusan kecurangan pemilu 2024 . Wakil rakyat harus merakyat.
"BISMILAH,,, 
Semoga menjadi keputusan JURDIL PEMILU 2024",Ricky*1453,0,0,0,2024-03-05T13:05:18.000Z,"BISMILAH,,,  Semoga menjadi keputusan JURDIL PEMILU 2024"
"Ngikutin Pemilu Kok kaya drakor ya, makin banyak saja lakonnya. Mulai QC, SiRekap dan Angka Naik turun hingga Hak angket yg kabur ntah ke mana #Pemilu2024 #sirekap #kpu #pilpres",Lukman Hanafi,0,0,0,2024-03-05T16:29:06.000Z,"Ngikutin Pemilu Kok kaya drakor ya, makin banyak saja lakonnya. Mulai QC, SiRekap dan Angka Naik turun hingga Hak angket yg kabur ntah ke mana        "
"Pelihara Hubungan Baik Dengan Konstituen Jadi Kunci Hetifah Raup 146 Ribu Suara di Pemilu 2024
#airlanggahartarto #kuningkeren #PrabowoGibran #partaigolkar #golkarpedia",#GolkarSolid,0,6,6,2024-03-05T12:59:00.000Z,Pelihara Hubungan Baik Dengan Konstituen Jadi Kunci Hetifah Raup 146 Ribu Suara di Pemilu 2024          
"TEGAS ! PKB DUKUNG HAK ANGKET DPR RI USUT KECURANGAN PEMILU 2024, JANGAN JADI PENGKHIANAT RAKYAT !",Owwalaah,0,0,0,2024-03-05T16:58:35.000Z,"TEGAS ! PKB DUKUNG HAK ANGKET DPR RI USUT KECURANGAN PEMILU 2024, JANGAN JADI PENGKHIANAT RAKYAT !"
"Hasil Sementara Suara DPD RI Pemilu 2024: Komeng Posisi Teratas https://indopolitika.com/hasil-sementara-suara-dpd-ri-pemilu-2024-komeng-posisi-teratas/ via 
@Indopolitika",Indopolitika.com,0,0,0,2024-03-05T11:44:08.000Z,Hasil Sementara Suara DPD RI Pemilu 2024: Komeng Posisi Teratas  via   
"Aksi demo tolak pemilu2024 yang dibakar gambar presiden . 
Banyak maunya ya.. Mending satu"" Maunya yg urut yg mana dulu ",#PolitikUang2024,0,0,1,2024-03-05T14:34:40.000Z,"Aksi demo tolak pemilu2024 yang dibakar gambar presiden .  Banyak maunya ya.. Mending satu"" Maunya yg urut yg mana dulu "
"KPU menegaskan, apabila terdapat kesalahan penghitungan suara di Pemilu 2024, akan ditelusuri satu per satu.
Hal tersebut sebagai respons KPU menanggapi dugaan penggelembungan suara PSI di Pemilu 2024 yang akhir-akhir ini menjadi sorotan publik. (ld)",Tribunnews.com,0,1,0,2024-03-05T12:00:00.000Z,"KPU menegaskan, apabila terdapat kesalahan penghitungan suara di Pemilu 2024, akan ditelusuri satu per satu. Hal tersebut sebagai respons KPU menanggapi dugaan penggelembungan suara PSI di Pemilu 2024 yang akhir-akhir ini menjadi sorotan publik. (ld)"
"Pemilu 2014 dan 2019 Indonesia pecah jadi Kecebong dan Kampret dengan perolehan yang ketat.

Pemilu 2024 Indonesia Pecah jadi Pemenang  dan Pecundang dengan angka yang longgar kaya lapangan bola.

Kalo Pecundang marahnya cuma bentaran aja, pas lapar mereka akan merapat kok ",RUDI VALINKA,89,81,379,2024-03-05T12:08:52.000Z,"Pemilu 2014 dan 2019 Indonesia pecah jadi Kecebong dan Kampret dengan perolehan yang ketat.  Pemilu 2024 Indonesia Pecah jadi Pemenang  dan Pecundang dengan angka yang longgar kaya lapangan bola.  Kalo Pecundang marahnya cuma bentaran aja, pas lapar mereka akan merapat kok "
"Pemilu 2024, jadi kesempatan kita buat jadi change maker",Rangga Adhianto,0,0,0,2024-03-05T18:18:18.000Z,"Pemilu 2024, jadi kesempatan kita buat jadi change maker"
Massa meminta DPR segera menggunakan hak angket untuk menyikapi indikasi kecurangan Pemilu 2024,Kompas Klasika,0,0,0,2024-03-05T12:21:12.000Z,Massa meminta DPR segera menggunakan hak angket untuk menyikapi indikasi kecurangan Pemilu 2024
"Daftar 10 Besar Suara Caleg Dapil 5 Jepara Pemilu 2024, Politisi Wanita Ini Sementara Unggul",tribunjateng.com,0,0,0,2024-03-05T11:15:03.000Z,"Daftar 10 Besar Suara Caleg Dapil 5 Jepara Pemilu 2024, Politisi Wanita Ini Sementara Unggul"
UNPAR Menggeliat! Protes Keras Terhadap Pemilu 2024 yang Ternyata Hanya Melahirkan Dinasti Jokowi,MATA BANDUNG-part of Pikiran Rakyat Media Network,0,0,0,2024-03-05T23:48:37.000Z,UNPAR Menggeliat! Protes Keras Terhadap Pemilu 2024 yang Ternyata Hanya Melahirkan Dinasti Jokowi
"Kita adalah satu keluarga, mari jaga keharmonisan dalam Pemilu 2024.",Riku Richi,0,0,0,2024-03-05T15:41:57.000Z,"Kita adalah satu keluarga, mari jaga keharmonisan dalam Pemilu 2024."
"Untuk melangkah lebih lanjut, sebaiknya tunggu dulu keputusan dari DPR apakah jadi menggulirkan Hak Angket DPR  dalam waktu dekat ini untuk menyidik dugaan-dugaan kecurangan dalam Pemilu 2024",ibnu purna,0,0,0,2024-03-05T14:39:57.000Z,"Untuk melangkah lebih lanjut, sebaiknya tunggu dulu keputusan dari DPR apakah jadi menggulirkan Hak Angket DPR  dalam waktu dekat ini untuk menyidik dugaan-dugaan kecurangan dalam Pemilu 2024"
"Bila ada TANGAN2 SETAN seperti ini partai sulap indodagelan, bisa di diskualifikasi dari pileg atau pileg dan pilpres di ulang lagi, begitulah kelakuan kecurangan jorok KPU dan Mukidi di Pilpres Pemilu 2024 ini. 
",Hasian,0,0,0,2024-03-05T16:59:58.000Z,"Bila ada TANGAN2 SETAN seperti ini partai sulap indodagelan, bisa di diskualifikasi dari pileg atau pileg dan pilpres di ulang lagi, begitulah kelakuan kecurangan jorok KPU dan Mukidi di Pilpres Pemilu 2024 ini.  "
Sidang Paripurna DPD RI Sepakat Bentuk Pansus Kecurangan Pemilu 2024,PRESIDEN LSM LIRA,0,0,3,2024-03-05T21:48:19.000Z,Sidang Paripurna DPD RI Sepakat Bentuk Pansus Kecurangan Pemilu 2024
"Anggota Komisi II DPR RI dari Fraksi Partai NasDem Aminurokhman menegaskan hak angket DPR bisa menjadi salah satu jalan untuk menguak kecurangan sekaligus evaluasi tahapan Pemilu 2024. 

Legislator NasDem ini mendorong agar hak angket bisa jadi jalan untuk perbaikan kualitas",Partai NasDem,55,206,653,2024-03-05T12:05:46.000Z,Anggota Komisi II DPR RI dari Fraksi Partai NasDem Aminurokhman menegaskan hak angket DPR bisa menjadi salah satu jalan untuk menguak kecurangan sekaligus evaluasi tahapan Pemilu 2024.   Legislator NasDem ini mendorong agar hak angket bisa jadi jalan untuk perbaikan kualitas
#DukungHakAngketDPR  bongkar KECURANGAN PEMILU 2024.,#MENLU RI BIADAB MATI'IN REZEKI TKI,0,0,0,2024-03-05T17:15:10.000Z,   bongkar KECURANGAN PEMILU 2024.
"Bersatulah warga bangsa yang pro demokrasi, kejujuran, kebenaran dan keadilan... Bongkar semua kecurangan dan intervensi penguasa dalam pemilu 2024...",Ferrywan,0,0,0,2024-03-05T12:17:09.000Z,"Bersatulah warga bangsa yang pro demokrasi, kejujuran, kebenaran dan keadilan... Bongkar semua kecurangan dan intervensi penguasa dalam pemilu 2024..."
Demo di depan Gedung DPR Jakarta pada Selasa (05/03/2024) menuntut batalkan Pilpres Pemilu 2024 yg Super Curang.,Hasian,0,0,1,2024-03-05T17:01:40.000Z,Demo di depan Gedung DPR Jakarta pada Selasa (05/03/2024) menuntut batalkan Pilpres Pemilu 2024 yg Super Curang.
Formappi: Hak Angket Pemilu 2024 Layu Sebelum Berkembang https://otonominews.id/2024/03/06/formappi-hak-angket-pemilu-2024-layu-sebelum-berkembang/,"OtonomiNEWS - Berita Terbaru, Terkini Indonesia",0,0,0,2024-03-05T23:33:27.000Z,Formappi: Hak Angket Pemilu 2024 Layu Sebelum Berkembang 
"Massa Bakar Spanduk Raksasa Gambar Jokowi di Depan Gedung DPR 

Massa aksi mendukung hak angket dugaan kecurangan Pemilu 2024, di depan Gedung DPR RI, membakar spanduk berukuran besar bergambar Presiden Jokowi.",Blackshark7890,4,15,35,2024-03-05T17:16:17.000Z,"Massa Bakar Spanduk Raksasa Gambar Jokowi di Depan Gedung DPR   Massa aksi mendukung hak angket dugaan kecurangan Pemilu 2024, di depan Gedung DPR RI, membakar spanduk berukuran besar bergambar Presiden Jokowi."
Banteng Kota Solo Siap Laporkan Dugaan Pelanggaran Administrasi Pemilu 2024 ke Bawaslu,Gesuri,0,0,0,2024-03-05T21:45:37.000Z,Banteng Kota Solo Siap Laporkan Dugaan Pelanggaran Administrasi Pemilu 2024 ke Bawaslu
"Dan kalo kita berharap pihak2 yg kalah bersikap 'gentlemen' dg tdk membawa keputusan kpu tentang hasil pemilu 2024 ke MK, maka sepertinya kita akan memiliki Presiden yg tdk 'gentlemen', krn pernah menggugat keputusan KPU di 2019, begitu logikanya kan prof?",Imron Hamzah,0,0,0,2024-03-05T23:26:14.000Z,"Dan kalo kita berharap pihak2 yg kalah bersikap 'gentlemen' dg tdk membawa keputusan kpu tentang hasil pemilu 2024 ke MK, maka sepertinya kita akan memiliki Presiden yg tdk 'gentlemen', krn pernah menggugat keputusan KPU di 2019, begitu logikanya kan prof?"
"Sistem Informasi Pemilu 2024 yang Buruk akan Hasilkan Penyajian Data Tak Valid.

Dugaan penggelembungan suara banyak ditemukan di sejumlah daerah. Dan bahkan sebagian di antaranya telah diakui oleh pengurus PPK setempat.

https://kbanews.com/hot-news/sistem-informasi-pemilu-2024-yang-buruk-akan-hasilkan-penyajian-data-tak-valid/",Nico Simanjuntak,0,0,1,2024-03-05T18:26:31.000Z,Sistem Informasi Pemilu 2024 yang Buruk akan Hasilkan Penyajian Data Tak Valid.  Dugaan penggelembungan suara banyak ditemukan di sejumlah daerah. Dan bahkan sebagian di antaranya telah diakui oleh pengurus PPK setempat.  
"#SahabatBawaslu, Rapat Pleno Terbuka Rekapitulasi Hasil Penghitungan Suara Luar Negri Tingkat Nasional telah selesai. PPLN Taipei menjadi yang terakhir menyampaikan kejadian khusus yang terjadi selama Pemilu 2024 berlangsung di sana.",BAWASLU KOTA CIREBON,0,0,2,2024-03-05T13:54:16.000Z," , Rapat Pleno Terbuka Rekapitulasi Hasil Penghitungan Suara Luar Negri Tingkat Nasional telah selesai. PPLN Taipei menjadi yang terakhir menyampaikan kejadian khusus yang terjadi selama Pemilu 2024 berlangsung di sana."
"Taufik menyebut, pihaknya lagi ngumpulin tanda tangan dari setiap anggota fraksi mereka di DPR RI untuk mendukung usulan hak angket kecurangan Pemilu 2024.",suaradotcom,1,0,0,2024-03-05T13:32:05.000Z,"Taufik menyebut, pihaknya lagi ngumpulin tanda tangan dari setiap anggota fraksi mereka di DPR RI untuk mendukung usulan hak angket kecurangan Pemilu 2024."
"Hidayat Nur Wahid Tanggapi Dugaan Kecurangan Pemilu 2024, PSI dan Hak Angket",Bisnis Bandung,0,0,0,2024-03-05T12:32:35.000Z,"Hidayat Nur Wahid Tanggapi Dugaan Kecurangan Pemilu 2024, PSI dan Hak Angket"
"KPU menegaskan bahwa hasil Pemilu 2024 adalah berdasarkan rekapitulasi manual berjenjang yang saat ini sedang berlangsung dari mulai Panitia Pemilihan Kecamatan (PPK), tingkat kecamatan sampai di tingkat nasional di KPU RI.

___
FB IG Devina Amel Ganjar
Fitra Eri Heru Budi Ini X",NEW UPDATE,2,11,11,2024-03-05T23:46:53.000Z,"KPU menegaskan bahwa hasil Pemilu 2024 adalah berdasarkan rekapitulasi manual berjenjang yang saat ini sedang berlangsung dari mulai Panitia Pemilihan Kecamatan (PPK), tingkat kecamatan sampai di tingkat nasional di KPU RI.  ___ FB IG Devina Amel Ganjar Fitra Eri Heru Budi Ini X"
"T S M

Tipu
Semaunya
Mencolok

Question of the day :
Klw Hak Angket berhasil & kecurangan Pemilu 2024 terbongkar..kira Presiden akan kabur ke LN ga?",mindlipstick,0,1,5,2024-03-05T15:58:08.000Z,T S M  Tipu Semaunya Mencolok  Question of the day : Klw Hak Angket berhasil & kecurangan Pemilu 2024 terbongkar..kira Presiden akan kabur ke LN ga?
Pemilu 2024 ini adalah pemilu paling tak beradab.,Gunalo,0,0,1,2024-03-05T19:24:13.000Z,Pemilu 2024 ini adalah pemilu paling tak beradab.
Personel Jaga Polsek Cibeunying Kidul PAM Logistik Pasca Pemilu 2024 Melekat di Gudang PPK Kecamatan Cibeunying Kidul,Polsek Cibeunying Kidul,0,0,0,2024-03-05T23:48:42.000Z,Personel Jaga Polsek Cibeunying Kidul PAM Logistik Pasca Pemilu 2024 Melekat di Gudang PPK Kecamatan Cibeunying Kidul
"Nasional

Sejumlah tokoh dalam Gerakan Penegakan Kedaulatan Rakyat (GPKR) tuntut tiga hal terkait Pemilu 2024, di Gedung Balai Sarbini, Jakarta Pusat, Selasa (5/3).

Diikuti Din Syamsudin, (Purn TNI) Fachrul Razi, dll.
https://youtube.com/watch?v=vwkw_nJR8Dc

PKS Oposisi?",HijiBerita,0,0,0,2024-03-05T16:16:30.000Z,"Nasional  Sejumlah tokoh dalam Gerakan Penegakan Kedaulatan Rakyat (GPKR) tuntut tiga hal terkait Pemilu 2024, di Gedung Balai Sarbini, Jakarta Pusat, Selasa (5/3).  Diikuti Din Syamsudin, (Purn TNI) Fachrul Razi, dll.   PKS Oposisi?"
"Bupati Tuban Sebut Pelaksanaan Pemilu 2024 Aman, Lancar, dan Kondusif. 

Bupati Tuban Aditya Halindra Faridzky menyatakan bahwa pelaksanaan Pemilihan Umum (Pemilu) tahun 2024 di wilayah http://dlvr.it/T3dxYw #PolitikPemerintahan #bupatituban #Tuban via 
@beritajatimcom",beritajatim,0,0,0,2024-03-05T13:57:36.000Z,"Bupati Tuban Sebut Pelaksanaan Pemilu 2024 Aman, Lancar, dan Kondusif.   Bupati Tuban Aditya Halindra Faridzky menyatakan bahwa pelaksanaan Pemilihan Umum (Pemilu) tahun 2024 di wilayah        via   "
Terungkap! Ternyata Ketum PDIP Megawati Belum Keluarkan Instruksi Soal Hak Angket Pemilu 2024,OposisiCerdas.com,2,8,9,2024-03-05T23:48:28.000Z,Terungkap! Ternyata Ketum PDIP Megawati Belum Keluarkan Instruksi Soal Hak Angket Pemilu 2024
"Belum Resmi Diajukan, Hak Angket Kecurangan Pemilu 2024 Didorong dalam Rapat Paripurna DPR https://balipuspanews.com/belum-resmi-diajukan-hak-angket-kecurangan-pemilu-2024-didorong-dalam-rapat-paripurna-dpr.html?utm_source=dlvr.it&utm_medium=twitter #Jakarta #News #BeritaJakarta #DPRRI #Hakangket",Balipuspanews.com,0,0,0,2024-03-06T00:05:06.000Z,"Belum Resmi Diajukan, Hak Angket Kecurangan Pemilu 2024 Didorong dalam Rapat Paripurna DPR           "
"Partai Golkar Kota Binjai Berpotensi Besar Rebut Kursi Ketua DPRD

Partai Golkar potensial merebut kursi Ketua DPRD Kota Binjai setelah bersaing ketat dengan partai Demokrat dan Partai PKS berdasarkan hasil rekapitulasi suara pada Pemilu 2024.",Media Penggalangan Opini Partai GOLKAR Kota Binjai,0,0,3,2024-03-05T13:25:59.000Z,Partai Golkar Kota Binjai Berpotensi Besar Rebut Kursi Ketua DPRD  Partai Golkar potensial merebut kursi Ketua DPRD Kota Binjai setelah bersaing ketat dengan partai Demokrat dan Partai PKS berdasarkan hasil rekapitulasi suara pada Pemilu 2024.
"Anggota Komisi II DPR RI, Aus Hidayat Nur menyampaikan interupsi terkait pengunaan hak angket untuk mengklarifikasi kecurigaan dan praduga masyarakat atas sejumlah permasalahan dalam penyelenggaraan pemilu 2024. #HakAngket #PKS #pemilu2024",Herald Indonesia,0,0,0,2024-03-05T11:05:36.000Z,"Anggota Komisi II DPR RI, Aus Hidayat Nur menyampaikan interupsi terkait pengunaan hak angket untuk mengklarifikasi kecurigaan dan praduga masyarakat atas sejumlah permasalahan dalam penyelenggaraan pemilu 2024.      "
"Bismillah.. smoga Allah bukakan jalan, dan menutup kedzaliman2 dalam mencari kebenaran Pemilu 2024",luna,0,0,0,2024-03-05T16:35:48.000Z,"Bismillah.. smoga Allah bukakan jalan, dan menutup kedzaliman2 dalam mencari kebenaran Pemilu 2024"
"PKB,
Pemilu 2024 CURANG brutal
- kpn daftar ke KPU
- kpn ikut kampanye, debat capres cawapres, pencoblosan
- knp tetep ikut pemilu pileg pilpres

#BUKAN 
ANGKET , BOIKOT pemilu 2024

Bloon",AcoyBK,0,0,0,2024-03-05T11:11:52.000Z,"PKB, Pemilu 2024 CURANG brutal - kpn daftar ke KPU - kpn ikut kampanye, debat capres cawapres, pencoblosan - knp tetep ikut pemilu pileg pilpres     ANGKET , BOIKOT pemilu 2024  Bloon"
"Politikus Gerindra itu juga meminta partai yang kalah dalam Pemilu 2024 untuk menerima dan tidak menuduh curang. Hal itu disampaikannya saat rapat paripurna DPR, Selasa (4/3).

#Gerindra #Haksopirangkot #Sopirangkot #Pilpres #PrabowoGibran",Lensa Indonesia RTV,0,0,0,2024-03-05T12:55:56.000Z,"Politikus Gerindra itu juga meminta partai yang kalah dalam Pemilu 2024 untuk menerima dan tidak menuduh curang. Hal itu disampaikannya saat rapat paripurna DPR, Selasa (4/3).           "
"Pemilu 2024 adalah milik rakyat, Rezim Jokowi adalah Perusak Demokrasi, kudeta Pemilu adalah kudeta konstitusi pelakunya layak dihukum mati !!!
Gantung mati ketua KPU !!!
#Pemilu2024MilikRakyatRI 
#Pemilu2024MilikRakyatRI",LAWAN DIRTY VOTE !!!,32,611,1.2K,2024-03-05T13:07:25.000Z,"Pemilu 2024 adalah milik rakyat, Rezim Jokowi adalah Perusak Demokrasi, kudeta Pemilu adalah kudeta konstitusi pelakunya layak dihukum mati !!! Gantung mati ketua KPU !!!     "
Massa meminta DPR segera menggunakan hak angket untuk menyikapi indikasi kecurangan Pemilu 2024 http://dlvr.it/T3dk97 #Fotografi #AdadiKompas,Kompas Muda,0,0,0,2024-03-05T12:21:11.000Z,Massa meminta DPR segera menggunakan hak angket untuk menyikapi indikasi kecurangan Pemilu 2024     
"#SahabatBawaslu Bawaslu Jepara mengikuti rapat sosialisasi petunjuk teknis perselisihan  hasil pemilihan umum Pemilu 2024 secara daring melalui zoom meeting yang diselenggarakan oleh Bawaslu RI, Selasa (5/3). 

 #bawaslujepara #AyoAwasiBersama #PemiluSerentak2024",Bawaslu Jepara,0,0,0,2024-03-05T11:34:08.000Z,"  Bawaslu Jepara mengikuti rapat sosialisasi petunjuk teknis perselisihan  hasil pemilihan umum Pemilu 2024 secara daring melalui zoom meeting yang diselenggarakan oleh Bawaslu RI, Selasa (5/3).         "
"Aku setuju dengan kalimat ""Pemilu 2024 ini adalah pemilu yang terburuk""

Here's why
https://twitter.com/yourmelody0705/status/1764430698948309105?t=Q94NFJJniA_D-eKwryVHvg&s=19 

satu penyebab: presiden melakukan tindak abuse of power ",マジダ,0,0,1,2024-03-05T21:36:28.000Z,"Aku setuju dengan kalimat ""Pemilu 2024 ini adalah pemilu yang terburuk""  Here's why    satu penyebab: presiden melakukan tindak abuse of power "
"Semua peserta mestinya begitu, tapi dlm kontek pemilu 2024 bpk jgn menutup mata & telinga apa yg terjadi sebenarnya dengan kondisi demokrasi di Indonesia, dan menurut saya bpk tdk pas membangkin seperti itu.",ÈBÈ,0,0,0,2024-03-06T00:47:58.000Z,"Semua peserta mestinya begitu, tapi dlm kontek pemilu 2024 bpk jgn menutup mata & telinga apa yg terjadi sebenarnya dengan kondisi demokrasi di Indonesia, dan menurut saya bpk tdk pas membangkin seperti itu."
"Gen Z, mari jadi garda terdepan di pemilu 2024",Arya Sulaiman,0,0,0,2024-03-05T21:30:49.000Z,"Gen Z, mari jadi garda terdepan di pemilu 2024"
"Aamiin....
Siapapun yg ikut serta dalam kecurangan pemilu 2024 baik itu 
@jokowi
 ,dan para menteri nya maupun Polri-TNI, atau pun 
@KPU_ID
 
@bawaslu_RI
 , MK,,MKMK, DKPP,ASN, dan siapapun...maka terkutuk lah mereka",Bakorsi Liko,0,0,0,2024-03-05T15:47:41.000Z,"Aamiin.... Siapapun yg ikut serta dalam kecurangan pemilu 2024 baik itu     ,dan para menteri nya maupun Polri-TNI, atau pun         , MK,,MKMK, DKPP,ASN, dan siapapun...maka terkutuk lah mereka"
"Situs KPU Berubah Tampilan, Diagram Perolehan Suara Pemilu 2024 Tak Muncul",iNews,0,0,1,2024-03-05T15:37:36.000Z,"Situs KPU Berubah Tampilan, Diagram Perolehan Suara Pemilu 2024 Tak Muncul"
"Sebagai pelaku sejarah gerakan reformasi '98, Luluk menilai Pemilu tahun ini merupakan pesta demokrasi paling brutal dan menyakitkan. 

Simak berita menarik lainnya hanya di http://bantenhay.com

#bantenhay #luluknurhamidah #dpr #pemilu2024",Banten Hay,0,0,0,2024-03-05T15:53:39.000Z,"Sebagai pelaku sejarah gerakan reformasi '98, Luluk menilai Pemilu tahun ini merupakan pesta demokrasi paling brutal dan menyakitkan.   Simak berita menarik lainnya hanya di          "
